_id,app,appVersion,reviewText,author,date,ratingStars,ArDoc classification,classification,class1,class2,class3,copied to 30each,class4,class5
578940fb819cb7066ab40506,Calculator,05/01/01,I don't get why other calculators are trying to reinvent the wheel - taking the stock app and hiding away so much functionality is ingenious. That and it's mainly open source is a definite plus. One question... What does the Pro in-app purchase give?,Elvin Luff,04/06/16,5,INFORMATION_SEEKING,,LICENSING,,,,,
578940fb819cb7066ab40504,Calculator,05/01/01,GREAT very yeasy to use u must dounload,Surjal Mallik,06/06/16,5,OTHER,,APP USABILITY,,,,,
578940f9819cb7066ab40503,Calculator,05/01/01,Awsome,Muneeb Ahmad,08/06/16,5,OTHER,,OTHER,,,,,
578940f9819cb7066ab40502,Calculator,05/01/01,Really Good one,Aditya Sovani,09/06/16,4,OTHER,,OTHER,,,,,
578940f9819cb7066ab40501,Calculator,05/01/01,Good Good,Muhammad Khaleelur,12/06/16,4,OTHER,,OTHER,,,,,
578940f9819cb7066ab40500,Calculator,05/01/01,Love it,Megin Dunlap,13/06/16,5,OTHER,,OTHER,,,,,
578940f9819cb7066ab404ff,Calculator,05/01/01,Slow processing This calculator is good but slow. Please fix it. Otherwise it is best.,Kamesh Feels,14/06/16,2,OTHER,,PERFORMANCE,ERROR,,,,
578940f9819cb7066ab404fd,Calculator,05/01/01,Good But some button need to be in screen,Batman Oye,15/06/16,5,INFORMATION_GIVING,,UI,,,,,
578940f9819cb7066ab404fe,Calculator,05/01/01,"Amazing, minimal but powerful calculator. 10/10 - This is what the AOSP Calculator should have been.",Harshit Garg,15/06/16,5,OTHER,,OTHER,,,,,
578940f9819cb7066ab404fc,Calculator,05/01/01,Calculator Nice App,Ishan 888,16/06/16,5,OTHER,,OTHER,,,,,
578940f8819cb7066ab404fa,Calculator,05/01/01,Useful Great useful calculator,illusion Rony,17/06/16,5,OTHER,,OTHER,,,,,
578940f9819cb7066ab404fb,Calculator,05/01/01,It is very good Very good app.i like it,viji chris,17/06/16,5,OTHER,,OTHER,,,,,
578940f8819cb7066ab404f9,Calculator,05/01/01,Nice calculating...,Tasif Rayan,18/06/16,5,OTHER,,OTHER,,,,,
578940f8819cb7066ab404f8,Calculator,05/01/01,"Way, way, better than stock, once you swipe to find the extra options.",Edgardo Velez,19/06/16,5,OTHER,,UI,,,,,
578940f8819cb7066ab404f7,Calculator,05/01/01,"Great The animation sliding the second page is a bit weird, but this is perfect!",Robin Rai,20/06/16,5,OTHER,,UI,,,,,
578940f8819cb7066ab404f6,Calculator,05/01/01,Best calculator I have ever used !! Keep it up,Ashutosh Sathe,21/06/16,5,OTHER,,OTHER,,,,,
578940f6819cb7066ab404f4,Calculator,05/01/01,Simple simon Very simple .........,RICHARD BRUNSON,23/06/16,3,OTHER,,APP USABILITY,,,,,
578940f6819cb7066ab404f5,Calculator,05/01/01,Love it but why In app purchase? Why is this use in app purchases?,Tharindu Udara Ranasingha,23/06/16,5,INFORMATION_SEEKING,,LICENSING,,,,,
578940f6819cb7066ab404f3,Calculator,05/01/01,"Warning! This calculator is very nice and all, but, be aware, it doesn't understand the priorities when multiplying and adding, so you need to use brackets all the time. I have wasted my nerves on my calculations because of this!",Tadej Rezar,25/06/16,2,OTHER,,OTHER,,,,,
578940f6819cb7066ab404f2,Calculator,05/01/01,Just perfect but still needs many other functions like inverse trignometry and others... Plz add them too,Piyush Soni,28/06/16,5,INFORMATION_GIVING,,OTHER,,,,,
578940f4819cb7066ab404f0,Calculator,05/01/01,Does the job beautifully,Lijo Lalu Korah,01/07/16,5,OTHER,,OTHER,,,,,
578940f4819cb7066ab404f1,Calculator,05/01/01,Lack of simple features like memory.,Lav KovaÄçiÄ‡,01/07/16,2,INFORMATION_GIVING,,OTHER,,,,,
578940f4819cb7066ab404ef,Calculator,05/01/01,its my style like it :D,Nelson Leesong,04/07/16,5,OTHER,,OTHER,,,,,
578940f4819cb7066ab404ee,Calculator,05/01/01,Rounding problem I used to love it however it has a major problem with rounding.,Ian Sosa,05/07/16,2,PROBLEM_DISCOVERY,,OTHER,,,,,
578940f3819cb7066ab404ec,Calculator,05/01/01,Great Calculator Everything is so easy to access. Loved it,mehedi hasan,08/07/16,5,OTHER,,APP USABILITY,,,,,
578940f4819cb7066ab404ed,Calculator,05/01/01,It looks simple but a little bit complicated,Avvaru Sameer,08/07/16,5,OTHER,,APP USABILITY,,,,,
578940f3819cb7066ab404eb,Calculator,05/01/01,Best Cool app,Nasif Sadique,10/07/16,5,OTHER,,OTHER,,,,,
578940f3819cb7066ab404ea,Calculator,05/01/01,"When switching from an app with keyboard open, this app becomes really ugly. Please close keyboard in the beginning. It is showstopper for me.",Leonard Leonard,11/07/16,1,OTHER,,UI,,,,,
578940f3819cb7066ab404e9,Calculator,05/01/01,Great app Very good calculator and very usefull. I recommend to add mod function too.,mehul agarwal,12/07/16,4,OTHER,,OTHER,,,,,
57894175819cb7066ab405b3,CatLog,01/06/00,_ŸêÅThank you very many! _Ÿ˜‰,Hrvoje Bartulovic,07/02/15,5,OTHER,OTHER,OTHER,,,,,
57894175819cb7066ab405b4,CatLog,01/06/00,"Works, but looks ancient. The design is from pre-Holo times.",Markus Birth,07/02/15,4,OTHER,USAGE,UI,,,y,,
57894176819cb7066ab405b5,CatLog,01/06/00,Extremely useful Thank you for an excellent app!,Thomas Adams,07/02/15,5,OTHER,OTHER,OTHER,,,,,
57894176819cb7066ab405b6,CatLog,01/06/00,Needa only material design update,ferhat fÄ±rat,07/02/15,5,OTHER,USAGE,UI,,,y,,
57894175819cb7066ab405b2,CatLog,01/06/00,"THE Log App Does everything you need with a simple interface. Filter, search, record, save, send the log... Etc.",Evan B,10/02/15,5,OTHER,OTHER,UI,,,,,
57894175819cb7066ab405b1,CatLog,01/06/00,"Catalog reader This app is the tell-tell, jigs. Luuuuv it.",Colleen Darneille,11/02/15,5,OTHER,OTHER,OTHER,,,,,
57894173819cb7066ab405b0,CatLog,01/06/00,Great It is using root user. No other apps do that.,Jonas Jasas,19/02/15,5,OTHER,PROTECTION,SECURITY,,,y,,
57894173819cb7066ab405ae,CatLog,01/06/00,One of the apps you need. Not needing a log viewer is the only valid reason for not having CatLog.,Carl Luebbe,07/03/15,5,OTHER,OTHER,OTHER,,,,,
57894173819cb7066ab405af,CatLog,01/06/00,The app for the job. Nuff said.,Will N,07/03/15,5,OTHER,OTHER,OTHER,,,,,
57894173819cb7066ab405ad,CatLog,01/06/00,Amazing work. Was looking for something like this for a long time to debug my app.,Abhishek Saxena,09/03/15,5,OTHER,OTHER,OTHER,,,,,
57894172819cb7066ab405ac,CatLog,01/06/00,thanks to this app,elizer elizer,15/03/15,5,OTHER,,OTHER,,,,,
57894172819cb7066ab405ab,CatLog,01/06/00,"Stop looking elsewhere Of the logcat apps I've used, this is the best; line numbering, highlighting, filtering logs, saved output... definitely worth the donation.",Ralph Miranda,19/03/15,5,OTHER,PRICING,PRICE,,,Y,,
57894172819cb7066ab405aa,CatLog,01/06/00,Help!! I don't understand what is it?? What are working it?? Plz reply my review..,T.h. Sujon,23/03/15,3,OTHER,OTHER,APP USABILITY,,,,,
57894172819cb7066ab405a9,CatLog,01/06/00,great app but.. it took be about a week to figure out how to open up the menu on the device..ugh,Awesome Dude,01/04/15,5,INFORMATION_SEEKING,USAGE,UI,APP USABILITY,ERROR,Y,,
57894170819cb7066ab405a8,CatLog,01/06/00,Needs root,Gavriel Fleischer,04/04/15,3,OTHER,OTHER,SECURITY,,,,,
5789416e819cb7066ab405a7,CatLog,01/06/00,It works. Requires root access to debug other apps.,Danilo Nishimura,10/04/15,5,OTHER,PROTECTION,SECURITY,,,Y,,
5789416e819cb7066ab405a6,CatLog,01/06/00,Meow Meow,David T,20/04/15,5,OTHER,OTHER,OTHER,,,,,
5789416e819cb7066ab405a5,CatLog,01/06/00,Simples Just Works (tm),Ian Grody,22/04/15,5,OTHER,OTHER,APP USABILITY,,,,,
5789416e819cb7066ab405a4,CatLog,01/06/00,Bug report made easy Easily share logs online with you custom rom.dev and fix whatever problem your having. .,Sean Duckworth,26/04/15,5,OTHER,OTHER,OTHER,,,,,
5789416b819cb7066ab405a3,CatLog,01/06/00,Root,Denisa Ndoka,29/04/15,3,OTHER,OTHER,SECURITY,,,,,
5789416b819cb7066ab405a2,CatLog,01/06/00,"Great .. i use this to catch rogue apps and fine tuning, works great",Bhaskar Krishna,30/04/15,5,OTHER,OTHER,OTHER,,,,,
5789416b819cb7066ab405a1,CatLog,01/06/00,Great app Saved me so much time debugging my apps. Wish it wouldn't require root. I have root on my phone but not all the devices I test on.,Patrick McKay,04/05/15,5,OTHER,,SECURITY,,,,,
5789416b819cb7066ab405a0,CatLog,01/06/00,internet love cats so why the fuck not,Vivek Jindal,09/05/15,5,OTHER,,OTHER,,,,,
5789416a819cb7066ab4059f,CatLog,01/06/00,How to operate it? How the program obtain root acces? Get confuse,Reza Irdania Fitriawan,27/05/15,2,OTHER,,SECURITY,APP USABILITY,,,,
5789416a819cb7066ab4059e,CatLog,01/06/00,A must have,Travis Hall,31/05/15,5,OTHER,,OTHER,,,,,
5789416a819cb7066ab4059d,CatLog,01/06/00,Save my day Thank you guys!,Chan Lee,10/06/15,5,OTHER,,OTHER,,,,,
5789416a819cb7066ab4059c,CatLog,01/06/00,"Somewhat limited but does the job Can search in messages, yay, but can't exclude tags, can't search for specific tags. Try searching for the tag ""cm"" - it find a million tags that *contain* the letters.",Roman Starkov,12/06/15,4,OTHER,,OTHER,,,,,
57894168819cb7066ab4059b,CatLog,01/06/00,"Root access If your app need root access, you should have said so in the description!",AmÃ©lie AGAESSE,13/06/15,1,INFORMATION_GIVING,,SECURITY,,,,,
57894168819cb7066ab4059a,CatLog,01/06/00,Wonderful I have searched for this for long,Jimmy Ilenloa,15/06/15,5,OTHER,,OTHER,,,,,
57894168819cb7066ab40599,CatLog,01/06/00,Functional but UI is stuck in Gingerbread era and it still requires use of menu button to access option.,Matej DrobniÄç,16/06/15,3,INFORMATION_GIVING,,UI,ANDROID VERSION,,,,
57894168819cb7066ab40598,CatLog,01/06/00,Great Great,Sergio Lopez,01/07/15,5,OTHER,,OTHER,,,,,
57894166819cb7066ab40597,CatLog,01/06/00,Only understand if u r developer,Tejas Lodha,22/07/15,5,OTHER,,OTHER,,,,,
57894166819cb7066ab40596,CatLog,01/06/00,A good app for android developer,mitkari sunil,23/07/15,5,OTHER,,OTHER,,,,,
57894166819cb7066ab40594,CatLog,01/06/00,"It works without root after enabling the READ_LOGS permission for it, using adb: `pm grant org.jtb.alogcat android.permission.READ_LOGS` and restarting the app. This is needed on the newer Android versions. Please update the description to get one more start.",Jaroslav Henner,26/07/15,4,OTHER,,SECURITY,,,,,
57894166819cb7066ab40595,CatLog,01/06/00,Root access How do i get the root access? :/,Priya Ramdial,26/07/15,5,OTHER,,SECURITY,,,,,
57894164819cb7066ab40593,CatLog,01/06/00,Nice app. Not compatable with Lollipop? Cant seem to access the menus without the hardware menu button.,Dan Laurence,27/07/15,4,INFORMATION_GIVING,,ANDROID VERSION,UI,ERROR,,,
57894164819cb7066ab40592,CatLog,01/06/00,"Great! Very easy to use, many features of it, thanks!",Lukita Nugraha,29/07/15,5,OTHER,,OTHER,,,,,
57894164819cb7066ab40591,CatLog,01/06/00,Super good. Just need UI update (Material?).,S Yudha Septian,02/08/15,5,OTHER,,UI,,,,,
57894164819cb7066ab40590,CatLog,01/06/00,"Good but... Sometimes hang on filter screen. Also, app need to use new Android navigation method instead of menu key as this key is obsolete in newer Android devices.",Chuong Le Pham,10/08/15,2,INFORMATION_GIVING,,UI,ERROR,,,,
57894162819cb7066ab4058f,CatLog,01/06/00,Working very well Tried a lot many apps but this one works excellently.,Bipin Bedi,12/08/15,5,OTHER,,OTHER,,,,,
57894162819cb7066ab4058e,CatLog,01/06/00,Superb,Harsha Bharadwaj,20/08/15,4,OTHER,,OTHER,,,,,
57894162819cb7066ab4058d,CatLog,01/06/00,"If there's an ability to save to a file, it's so well hidden that it might as well not be there. When the app started, it said something about a widget, but that's all I ever saw about it other than being mentioned in the Play Store. This program is useless as delivered, since there's no way to get the logs off the device - holding my finger on the screen popped up an option to copy to the clipboard, but that was one line only. tested on Samsung Tab S with Android 5.0.2",Fred Koschara,23/08/15,1,OTHER,,APP USABILITY,ANDROID VERSION,DEVICE,,ERROR,UI
5789415e819cb7066ab4058c,CatLog,01/06/00,Works Nice,Tim L,28/08/15,5,OTHER,,OTHER,,,,,
5789415e819cb7066ab4058b,CatLog,01/06/00,How to How do you recorded plz help,Deadblockss Gamer,30/08/15,5,INFORMATION_SEEKING,,OTHER,,,,,
5789415e819cb7066ab40589,CatLog,01/06/00,Useful app For when you're not at your computer and a small bug is nagging you.,Mitchel Wodka,02/09/15,5,OTHER,,OTHER,,,,,
5789415e819cb7066ab4058a,CatLog,01/06/00,"Useful Useful, but it get weird rendering issues while scrolling. Glyphs remain in place while also moving so the screen becomes unreadable until I stop scrolling. Look into hardware/software rendering plz.",Marc Ashman,02/09/15,4,OTHER,,UI,ERROR,,,,
5789415c819cb7066ab40588,CatLog,01/06/00,"Scrolling gets hijacked Good app, but when i scroll up to read previous logs during live view, it autoscrolls away from what I'm reading, causing me to lose my place.",Rob Gatzke,03/09/15,3,OTHER,,UI,ERROR,,,,
5789415c819cb7066ab40587,CatLog,01/06/00,Menu key No way to access menu key,Raslin777,05/09/15,2,OTHER,,UI,ERROR,,,,
5789415c819cb7066ab40586,CatLog,01/06/00,"The best, but... Please, for the sake of all of the earth's inhabitants, change the ui and app icon.",A. Lee,08/09/15,5,OTHER,,UI,,,,,
5789415c819cb7066ab40585,CatLog,01/06/00,"Very useful but... I wish there was a way to filter logs by error level (warning, info, debug etc)...",Christophe PFERTZEL,18/09/15,4,INFORMATION_GIVING,,APP USABILITY,,,,,
57894159819cb7066ab40583,CatLog,01/06/00,Clone of debugger for android? One of you copied the other. Whoever really made this app should report the other to google because its probably malware.,Alex Johnson,24/09/15,3,OTHER,,SECURITY,,,,,
57894159819cb7066ab40584,CatLog,01/06/00,Thank you loran,Patel Shrey,24/09/15,5,OTHER,,OTHER,,,,,
57894159819cb7066ab40582,CatLog,01/06/00,It's okay Not too user friendly,Halo Ali,26/09/15,3,OTHER,,APP USABILITY,,,,,
57894159819cb7066ab40581,CatLog,01/06/00,Meow meow Very useful if you want to debug and troubleshoot something that is wrong with your device,Shahmi Saidi,02/10/15,5,OTHER,,OTHER,,,,,
57894158819cb7066ab40580,CatLog,01/06/00,"Top app For info (in case dev not already aware!), there is a graphical glitch when scrolling output in marshmallow on a nexus 5:)",Dave Johnson,06/10/15,5,OTHER,,UI,ANDROID VERSION,DEVICE,,ERROR,
57894156819cb7066ab4057f,CatLog,01/06/00,pretty good but I cannot open log file in logcat. I liked the way log is displayed in this app but I can't view the file in it. Also the pause button stops working if try to open file.,Rabin Shakya,09/10/15,4,OTHER,,UI,ERROR,,,,
57894156819cb7066ab4057e,CatLog,01/06/00,The best I don't use anything else,Mecca El,17/10/15,5,OTHER,,OTHER,,,,,
57894156819cb7066ab4057c,CatLog,01/06/00,There's no way top save the logs. The dev likely coded the menu function for phones with a dedicated capacitive menu button.,Chris Blasko,19/10/15,3,OTHER,,UI,ERROR,,,,
57894156819cb7066ab4057d,CatLog,01/06/00,Ok Ok,jamal harris,19/10/15,5,OTHER,,OTHER,,,,,
57894154819cb7066ab4057b,CatLog,01/06/00,Best For troubleshooting issues.,Odney Joseph,30/10/15,5,OTHER,,OTHER,,,,,
57894154819cb7066ab4057a,CatLog,01/06/00,Terrible Said my device tablet had to be rooted n it would only see the catlogs of the app itself.,Tamara Kurtz,06/12/15,1,OTHER,,SECURITY,,,,,
57894154819cb7066ab40579,CatLog,01/06/00,Simple and does the job,Sebastian Di Mateo,10/12/15,5,OTHER,,APP USABILITY,,,,,
57894154819cb7066ab40578,CatLog,01/06/00,Woohoo! Helped me find what was causing a super annoying system ui crash!,Morgan Robles,13/12/15,5,OTHER,,OTHER,,,,,
57894153819cb7066ab40577,CatLog,01/06/00,Can't access menus. I can't access the menus at all so this app is of little use to me.,Techno Reaper,16/12/15,2,INFORMATION_GIVING,,UI,ERROR,,,,
57894153819cb7066ab40576,CatLog,01/06/00,"Unrivaled, best of it's own kind",XspeedPL,02/01/16,5,OTHER,,OTHER,,,,,
57894153819cb7066ab40574,CatLog,01/06/00,"Works unrooted on Android 5.1, correct adb command is: pm grant com.nolanlawson.logcat android.permission.READ_LOGS",David Sainty,17/01/16,5,OTHER,,SECURITY,ANDROID VERSION,,,,
57894153819cb7066ab40575,CatLog,01/06/00,Yup Good at pouncing bugs.,Alexander E.,17/01/16,5,OTHER,,OTHER,,,,,
57894151819cb7066ab40573,CatLog,01/06/00,Marshmallow ready? Doesn't seem to play well with cm13... Love it for anything else!,Jerimiah Mack,18/01/16,4,OTHER,,ANDROID VERSION,DEVICE,,,,
57894151819cb7066ab40572,CatLog,01/06/00,"Bug Maybe its just me, but the catlog does not display anything... It was working before but on cm13 the circle just keeps rotating like it can't find anything... Any idea? :)",Boris PerkoviÄ‡,24/01/16,5,OTHER,,DEVICE,UI,ERROR,,,
57894151819cb7066ab40571,CatLog,01/06/00,"No useful log It shows only log about touch and scroll the listview, I did not see any other log",Quá»‘c CÆ°á»ùng NgÃ´,30/01/16,1,OTHER,,UI,,,,,
57894151819cb7066ab40570,CatLog,01/06/00,"Nice Great app. Does what you need, simple as that.",andrew wright,06/02/16,5,OTHER,,APP USABILITY,,,,,
57894150819cb7066ab4056f,CatLog,01/06/00,"It works as stated in that you can see catch any random force close when trying to figure out an issue, however it seems dev needs to code the menu button for lollipop up. Seems only coded for dedicated hardware button and not soft keys. The 3 dot menu option is not available. This essentially makes the tool useless to me as I need to extract and email the logs. Dev please update app",M. Bennett,07/02/16,2,OTHER,,UI,ANDROID VERSION,ERROR,,,
57894150819cb7066ab4056e,CatLog,01/06/00,Good,martin Raymond,08/02/16,5,OTHER,,OTHER,,,,,
5789414d819cb7066ab4056c,CatLog,01/06/00,Amazing,Daizu A,09/02/16,5,OTHER,,OTHER,,,,,
57894150819cb7066ab4056d,CatLog,01/06/00,Cannot share the logs. The 3 dot menu opens the RECENT MENU. Help!,Jaaro 01,09/02/16,1,OTHER,,UI,ERROR,,,,
5789414d819cb7066ab4056b,CatLog,01/06/00,great,Eli Jim,11/02/16,5,OTHER,,OTHER,,,,,
5789414d819cb7066ab4056a,CatLog,01/06/00,THANK YOU FOR YOUR EFFORT! THIS APP ISN'T SUPPORTED ANYMORE! use MatLog instead!,Marc Schermesser,24/02/16,5,OTHER,,ERROR,,,,,
5789414d819cb7066ab40569,CatLog,01/06/00,"Why no custom default location to save log file Like other log apps, this also does not have option to set a folder to save all log files.",Athar Khan,03/03/16,1,INFORMATION_SEEKING,,UI,,,,,
5789414b819cb7066ab40568,CatLog,01/06/00,Amazing This app helped me a lot. Allowed me to see why my apps crashed so I could fix the bugs. Good job. :),Aakash Rattlehead,10/03/16,5,OTHER,,OTHER,,,,,
5789414b819cb7066ab40567,CatLog,01/06/00,Thanks! Helps a ton with development!,K Bell,25/03/16,5,OTHER,,OTHER,,,,,
5789414b819cb7066ab40566,CatLog,01/06/00,Glitches when scrolling on marshmallow,Louis Solomon,16/04/16,1,OTHER,,UI,ANDROID VERSION,ERROR,,,
5789414b819cb7066ab40565,CatLog,01/06/00,"Works but issues Everything works as intended, except when you scroll the text becomes distorted and flashes oddly. Needs to be redone.",Drew,19/04/16,3,INFORMATION_GIVING,,UI,ERROR,,,,
5789414a819cb7066ab40563,CatLog,01/06/00,Great app but how do i save logs with no touch menu buttons on galaxy s5?,Phillip Crawley,22/04/16,4,INFORMATION_SEEKING,,UI,DEVICE,,,,
5789414a819cb7066ab40564,CatLog,01/06/00,Material Design please.,Ethan Brittain-Morby,22/04/16,5,OTHER,,UI,,,,,
5789414a819cb7066ab40562,CatLog,01/06/00,Useful in the time of need,Ashwin Raaghav,01/05/16,5,OTHER,,OTHER,,,,,
57894148819cb7066ab40560,CatLog,01/06/00,Great app Great app,Dipayan Sukul,08/05/16,5,OTHER,,OTHER,,,,,
5789414a819cb7066ab40561,CatLog,01/06/00,It's cool but... I'd suggest adding a feature to capture only a specific process individually (per app). Other than that it's very helpful indeed. I discovered and fixed many FCs in various apps using Catlog.,Manx A.,08/05/16,3,OTHER,,OTHER,,,,,
57894148819cb7066ab4055f,CatLog,01/06/00,Very useful app for developers. Only small negative is that recorded logs stop when you view them. I would like a button to stop them when desired.,Gualtiero Chiaia,09/05/16,4,OTHER,,UI,,,,,
57894148819cb7066ab4055e,CatLog,01/06/00,"No menu button Menu buttons are Android standard at this point, bad dev practice here",Joshua Selvidge,29/05/16,2,OTHER,,UI,,,,,
57894148819cb7066ab4055d,CatLog,01/06/00,The best,Cesar Matias,06/06/16,5,OTHER,,OTHER,,,,,
57894147819cb7066ab4055c,CatLog,01/06/00,indispensable if you debug apps for a living. no idea how this isn't part of the OS!,ãÅ_ç¥–çˆ¶ãÅèã‚“ç´«é™_è_±å_ê,15/06/16,5,OTHER,,OTHER,,,,,
57894147819cb7066ab4055b,CatLog,01/06/00,Nice,habib tito,08/07/16,5,OTHER,,OTHER,,,,,
57894147819cb7066ab4055a,CatLog,01/06/00,Not user friendly it needs to be updated so it could work with lollipop and above. Most newer phones DO NOT HAVE HARDWARE BUTTONS. One â˜… forever,William Crump,10/07/16,1,OTHER,,ANDROID VERSION,UI,APP USABILITY,,,
57894147819cb7066ab40559,CatLog,01/06/00,"Great app I use it daily, nice and easy. Thank you!",Adam Wonski,13/07/16,5,OTHER,,APP USABILITY,,,,,
57893a96819cb7066ab3fe13,Duck Duck GO,3.0.12,Awesome! Bye bye google!,Iulian Ionescu,08/02/16,5,OTHER,,OTHER,,,,,
57893a95819cb7066ab3fe12,Duck Duck GO,3.0.12,Thanks Thanks for ousting Google. Great app!!,Stephen Nelson,09/02/16,5,OTHER,,OTHER,,,,,
57893a95819cb7066ab3fe0f,Duck Duck GO,3.0.12,Most useful One of my favorite apps.,Mike in do-dah,10/02/16,5,OTHER,,OTHER,,,,,
57893a95819cb7066ab3fe10,Duck Duck GO,3.0.12,"Good app, but needs tabs, preferably like the tabs in Firefox's browser. That is the last thing holding me back from using duck as my primary browser.",Jayson Mena,10/02/16,4,OTHER,,UI,,,,,
57893a95819cb7066ab3fe11,Duck Duck GO,3.0.12,Don't track us,Misty C.,10/02/16,5,INFORMATION_GIVING,,PRIVACY,,,,,
57893a93819cb7066ab3fe0c,Duck Duck GO,3.0.12,No.1 non tracking search app Used this after Google tax dodge really annoyed me. Found it just as good for my needs.,Pete M,11/02/16,5,OTHER,,PRIVACY,,,,,
57893a93819cb7066ab3fe0d,Duck Duck GO,3.0.12,"Works well, discreet. In a world where ""Big Brother"" watches everything we do, DuckDuckGo is one of the ""key"" pieces to keeping a user's searches private... And with the integrated Tor support, this is completely achievable (requires the third-party Tor applications). Highly recommended, to all.",Gregory Opera,11/02/16,4,OTHER,,PRIVACY,,,,,
57893a93819cb7066ab3fe0e,Duck Duck GO,3.0.12,Icon is now shown in Google Swipe. Thank you. Search results could be better tho,Rokas Jankunas,11/02/16,5,OTHER,,UI,,,,,
57893a90819cb7066ab3fe0b,Duck Duck GO,3.0.12,Great search engine,Shmuel Paycher,12/02/16,5,OTHER,,OTHER,,,,,
57893a90819cb7066ab3fe09,Duck Duck GO,3.0.12,Amazing This is like the best app ever. It has for support built in which is great. It is basically a full browser wish I could use it instead of Google but there is some good stuff Google has,TekTonik Dubstep,13/02/16,5,FEATURE_REQUEST,,OTHER,,,,,
57893a90819cb7066ab3fe0a,Duck Duck GO,3.0.12,"Finds everything The app finds everything the Google search app does, but this one does not track you. That alone makes this my frequent go to search app.",Dimitrios Papadakis,13/02/16,5,OTHER,,PRIVACY,,,,,
57893a8e819cb7066ab3fe07,Duck Duck GO,3.0.12,"Ad Blocker Please. Good and quick, an ad blocker in the built in browser would make it perfect.",Rohail Shah,14/02/16,4,OTHER,,OTHER,,,,,
57893a8e819cb7066ab3fe08,Duck Duck GO,3.0.12,Ok Good,Shekhar Godbole,14/02/16,4,OTHER,,OTHER,,,,,
57893a8d819cb7066ab3fe03,Duck Duck GO,3.0.12,Best,Dustin Robert,16/02/16,5,OTHER,,OTHER,,,,,
57893a8d819cb7066ab3fe04,Duck Duck GO,3.0.12,"Great job! I feel tons more secure browsing the web, this is a truely awesome app. Now I don't have that voice in the back of my head telling me that i'm going to get caught, although there's no reason to... _Ÿ‘Œ",Luke 7640,16/02/16,5,OTHER,,PRIVACY,,,,,
57893a8e819cb7066ab3fe05,Duck Duck GO,3.0.12,No themes?? What? No themes?? I want a black theme like the pc browser!!! :(,Yerman Keith,16/02/16,4,OTHER,,OTHER,,,,,
57893a8e819cb7066ab3fe06,Duck Duck GO,3.0.12,Sloww. dead sloww.,Sidharth Sreekumar,16/02/16,1,OTHER,,PERFORMANCE,ERROR,,,,
57893a8d819cb7066ab3fe02,Duck Duck GO,3.0.12,Nice app! Well it's a nice app providing anonymity but I don't think the world needs yet another browser if DuckDuckGo could provide some OK Google like features it would be great!,Sagar Panchmatia,17/02/16,4,INFORMATION_GIVING,,PRIVACY,,,,,
57893a8d819cb7066ab3fe01,Duck Duck GO,3.0.12,Great app I love it!,aunx antikulturex,18/02/16,5,OTHER,,OTHER,,,,,
57893a8a819cb7066ab3fdff,Duck Duck GO,3.0.12,"Tor not working. Problems with staying on Tor, at random it's connecting without it. It should be forced, like this you don't know when it stopped.",Longe Lack,19/02/16,3,INFORMATION_GIVING,,SECURITY,,,,,
57893a8a819cb7066ab3fe00,Duck Duck GO,3.0.12,Theme Is there a theme option similar to the desktop..I'm not a big fan of the default search results?,willie bloem,19/02/16,3,OTHER,,UI,,,,,
57893a8a819cb7066ab3fdfd,Duck Duck GO,3.0.12,DuckDuckR+DuckDuckGo Search & Stories Likely look style Pictures and Email.,Reginald Addison,23/02/16,4,OTHER,,OTHER,,,,,
57893a8a819cb7066ab3fdfe,Duck Duck GO,3.0.12,Still tracks you The browser is still tracking my searches even after i turned off autocomplete,Andrew Monroe,23/02/16,3,OTHER,,PRIVACY,,,,,
57893a88819cb7066ab3fdfc,Duck Duck GO,3.0.12,The best.,Violanthe Asteracea,24/02/16,5,OTHER,,OTHER,,,,,
57893a88819cb7066ab3fdfa,Duck Duck GO,3.0.12,This is app has a very special place :D I've been using this app for quite a while and proud to say I just love this app.For people who say its slow you must remember to get something great we have to sacrifice something else ..and from last updates It's way faster then previous version!! PS: To devs if theme of app is slightly dark then it will be very helpful for a long duration use :D @duckduckGo!!,anti Py,25/02/16,5,OTHER,,PERFORMANCE,,,,,
57893a88819cb7066ab3fdfb,Duck Duck GO,3.0.12,Needs tabs and change theme option,Rany,25/02/16,3,OTHER,,UI,,,,,
57893a82819cb7066ab3fdf8,Duck Duck GO,3.0.12,"The obvious choice of browser It delivers great results in a timely manner. Good show, creators of duckduckgo!",The Galvanizer,27/02/16,5,OTHER,,PERFORMANCE,,,,,
