_id,app,appVersion,reviewText,author,date,ratingStars,ArDoc classification,classification,class1,class2,class3,copied to 30each,class4,class5
57894d51819cb706b00a7b44,AcDisplay,03/08/04,_”Ñƒ_¶_µ Ñ‡Ñƒ_´_____¸__ _´___´_°Ñ‚___º. _ê_»_µ. _’_¸___¸_º_°Ñ”Ñ‚ÑŒÑÅÑè ___°Ñ‚_¸ÑÅ_º_°____Ñè__ _°_¿_°Ñ€_°Ñ‚____Ñ— _º_____¿_º_¸ Â«_”___´____ÑƒÂ».,Sergiy Khoruzhin,03/04/16,4,OTHER,,OTHER,,,,,
57894d51819cb706b00a7b45,AcDisplay,03/08/04,Dont bother Rubbish,Stevo K Atkinson,03/04/16,1,INFORMATION_GIVING,,OTHER,,,,,
57894d51819cb706b00a7b46,AcDisplay,03/08/04,Great lock screen app The app is amazing but there is an lag between opening from locks screen and home screen display. Please fix it.,anand seth,03/04/16,4,PROBLEM_DISCOVERY,,PERFORMANCE,UI,ERROR,,,
57894d42819cb706b00a7b3e,AcDisplay,03/08/04,"Pls fix a Bug Proximity sensor is not working properly. To wake it up, have to hold the proximity sensor for at least 5 sec. Phone model: Infocus",Rahul Mondal,04/04/16,3,OTHER,,HARDWARE,DEVICE,ERROR,,,
57894d48819cb706b00a7b3f,AcDisplay,03/08/04,Almost perfect. Please make it ALWAYS ON like the S7/Edge. And make it move randomly on the screen so it won't burn unless there's a way to do it. The way it handles notification is top notch and the material design is fantastic. Great work!,Samuel Tadeo,04/04/16,5,OTHER,,DEVICE,UI,,,,
57894d48819cb706b00a7b40,AcDisplay,03/08/04,"The application itself is really neat, it's exactly what i wanted, sadly the rating will be low due to it's not replacing the lockscreen, it's adding on top of it, which means i can't simply use my fingerscanner to go into the device immediately. The idea is 10/10 it's exactly what makes Android much better, hopefully this can be sorted.",Mahmoud Khoori,04/04/16,3,INFORMATION_GIVING,,SECURITY,ERROR,,,,
57894d4d819cb706b00a7b41,AcDisplay,03/08/04,"best lock screen but.. no security features, you have to use the phones own lockscreen which will require you to unlock the device twice. please consider adding even just pin and pattern, this will allow us to keep the phone private among friends even if it is not really secure(I read the faqs my phone does not allow pins only, it comes with the default lockscreen my phone will have 2 lockscreens when i enable it)",Elli Rellosa,04/04/16,4,OTHER,,SECURITY,,,,,
57894d3f819cb706b00a7b3a,AcDisplay,03/08/04,Buggy experience after Lollipop update After i updated my fone to 5.0 lollipop d lockscreen became buggy. It unlocks by pressing home button n sometimes after swipe unlocking it locks d display again.. please fix this. Also a suggestion to include always on mode like v find on d new galaxy s7 n lg g5..,Swapnil Ambawade,05/04/16,4,OTHER,,ANDROID VERSION,DEVICE,ERROR,,SECURITY,
57894d3f819cb706b00a7b3b,AcDisplay,03/08/04,Lame! Doesn't let me uninstall,Cisco G,05/04/16,1,INFORMATION_SEEKING,,ERROR,,,,,
57894d42819cb706b00a7b3c,AcDisplay,03/08/04,"Killed by alarm Once alarm rings this locker stops working. Goes back to default phone locker. Got to disable and re-enable aclocker. Do fix this bug, much appreciated.",Tay Wei Jia,05/04/16,3,PROBLEM_DISCOVERY,,ERROR,,,,,
57894d42819cb706b00a7b3d,AcDisplay,03/08/04,Awesome. But some bugs. This app is really awesome. I love it. But it's got some flaws like: it's got some lag in animations while unlocking. And it freezes at times while trying to open. Otherwise great app. You guys are awesome!,Raj Mehta,05/04/16,3,OTHER,,PERFORMANCE,ERROR,,,,
57894d3b819cb706b00a7b36,AcDisplay,03/08/04,"No unlock animation The app is great for personalisation, would give 5 stars if there was unlock animation on my samsung galaxy j7.........developers, do check my prob.",Darshil Chauhan,06/04/16,4,OTHER,,DEVICE,SECURITY,,,,
57894d3b819cb706b00a7b37,AcDisplay,03/08/04,Nagyon hasznos!,Attila AndrÃ¡s,06/04/16,5,OTHER,,OTHER,,,,,
57894d3b819cb706b00a7b38,AcDisplay,03/08/04,"Love it except... Updated my s6 to marshmallow and now the icons that show on the lock screen for notifications are screwed up - what's app shows as a triangle with ! inside, gmail is an h icon. What's going on?",Talia Bromstad,06/04/16,4,OTHER,,ANDROID VERSION,DEVICE,ERROR,,,
57894d3f819cb706b00a7b39,AcDisplay,03/08/04,"Not good for Note 5 Cant disable the touch buttons on lock screen, keeps unlocking my phone on my pocket.",Thomaz Franzotti,06/04/16,1,INFORMATION_GIVING,,DEVICE,UI,ERROR,,SECURITY,
57894d30819cb706b00a7b2f,AcDisplay,03/08/04,"Unable to remove the software from phone When I try to uncheck this tool from device administrators, android system app crashes... nexus 5 2013, android 6.0.1 with march update. Fix it asap",Ravi Kappagantula,07/04/16,1,PROBLEM_DISCOVERY,,ANDROID VERSION,DEVICE,ERROR,,,
57894d33819cb706b00a7b30,AcDisplay,03/08/04,"Can't see a single notification, nor can I remove apps from the blacklist, therefore this app is rubbish to say the least.",Gulam Hasan,07/04/16,1,INFORMATION_GIVING,,UI,ERROR,,,,
57894d33819cb706b00a7b31,AcDisplay,03/08/04,Locks me out of my phone. Try to press button to wake but screen stays black,Michael Bahurinsky,07/04/16,2,OTHER,,UI,ERROR,,,,
57894d33819cb706b00a7b32,AcDisplay,03/08/04,Awesome app. Simple and neat.. Keep improving slowly,Mohit Handa,07/04/16,5,OTHER,,APP USABILITY,,,,,
57894d33819cb706b00a7b33,AcDisplay,03/08/04,Its really great and quite stable,saurav chanda,07/04/16,5,OTHER,,OTHER,,,,,
57894d36819cb706b00a7b34,AcDisplay,03/08/04,"Brilliant app!! Edit: 'Had to uninstall. Started taking too much resources/battery in the background I don't know, if it's a bug or anything. Kindly fix it.' Really cool. It's a no nonsense app. Please do rem though this app keeps on running in the background and though it's not really a super heavy app but it's not feather weight either. It is perfectly fine by me, coz I find it to be totally worth it. It gives you a buttery smooth experience and the lock screen looks wise is damn cool. Love it. Thank you so much!!",abhinav gautam,07/04/16,2,OTHER,,BATTERY,PERFORMANCE,ERROR,,,
57894d36819cb706b00a7b35,AcDisplay,03/08/04,Useless and can't uninstall why can't I Uninstall it,Tom Ridgway,07/04/16,1,INFORMATION_GIVING,,ERROR,,,,,
57894d2b819cb706b00a7b2b,AcDisplay,03/08/04,Too sad That's a horrible app,Ri-guy Spongebill,08/04/16,1,OTHER,,OTHER,,,,,
57894d2b819cb706b00a7b2c,AcDisplay,03/08/04,"Please add a password or pin option please, otherwise great work!",Ian Russo,08/04/16,4,OTHER,,SECURITY,UI,,,,
57894d30819cb706b00a7b2d,AcDisplay,03/08/04,"The locker is cool but,... You need a security option",Rogy66,08/04/16,3,INFORMATION_GIVING,,SECURITY,UI,,,,
57894d30819cb706b00a7b2e,AcDisplay,03/08/04,Good one Can you add feature like moto display I.e screen lights up when we pick up the device or pick our device out of pocket,Snehasis Panda,08/04/16,5,INFORMATION_GIVING,,DEVICE,,,,,
57894d20819cb706b00a7b29,AcDisplay,03/08/04,Loved it! Does what it claims! And very usefull,sannidanam kaushik,09/04/16,5,OTHER,,OTHER,,,,,
57894d2b819cb706b00a7b2a,AcDisplay,03/08/04,"Please Read This is my favorite lockscreen app. However, i cannot add widgets to the interface! Every time i try to choose a widget it will say ""Unfortunately, Settings has stopped."" This is a major issue for me. I have widgets enabled and everything. I've tried it all. Please fix as this is a great app.",Marco Medel,09/04/16,5,INFORMATION_GIVING,,UI,ERROR,SECURITY,,,
57894d20819cb706b00a7b27,AcDisplay,03/08/04,Sucked Sucked,Gracie Walker,10/04/16,1,OTHER,,OTHER,,,,,
57894d20819cb706b00a7b28,AcDisplay,03/08/04,Few improvements til perfection Pls include blur option for the wallpaper and option to place the clock on the upper center of the screen.,xtof _,10/04/16,5,OTHER,,UI,,,,,
57894d1d819cb706b00a7b23,AcDisplay,03/08/04,Notifications Notifications won't show up on lockscreen! :(,Omar Ahmed,11/04/16,4,OTHER,,UI,ERROR,,,,
57894d1d819cb706b00a7b24,AcDisplay,03/08/04,"Almost perfect The notification, when selected to be open, gets cropped on the sides for a moment. I think it's a animation incomplete when opening the notification. If you guys could fix that, I would be delighted! Sorry for english errors, and Hi from Brazil!",Lucas Henrique,11/04/16,5,OTHER,,UI,ERROR,,,,
57894d1d819cb706b00a7b25,AcDisplay,03/08/04,_Ÿ”‘ I really love this. I cannot adapt to others screen lock application. It really great. Ive tried to use another but i cant.,Ahmad Firdaus,11/04/16,5,PROBLEM_DISCOVERY,,SECURITY,,,,,
57894d20819cb706b00a7b26,AcDisplay,03/08/04,Plz Add Lock Screen Feature to make it perfect.. Plz.......,Ritesh Kumaar,11/04/16,3,OTHER,,SECURITY,,,,,
57894d17819cb706b00a7b1d,AcDisplay,03/08/04,"Beautiful I love the look of this app. As long as it doesnt kill battery I'm cool. I haven't seen any quick battery drop yet, but its beautiful in the way it is.",Bryce Vogel,12/04/16,5,OTHER,,BATTERY,,,,,
57894d17819cb706b00a7b1e,AcDisplay,03/08/04,"Good! ...But.. The app is extremely amazing and the UI is beautiful too, but anyone can access through my phone because there is no security.",DeADLUA,12/04/16,3,OTHER,,UI,SECURITY,,,,
57894d1b819cb706b00a7b1f,AcDisplay,03/08/04,Dosent work... It dosent work on my Sony Aquos device tho and i will rate 5 because this is still beta and it works on my other phones and tablets,Redstoner PE,12/04/16,5,OTHER,,DEVICE,ERROR,,,,
57894d1b819cb706b00a7b20,AcDisplay,03/08/04,Like but Love this app however just lately it's started going to the lockscreen everytime there is a notification regardless of if I'm in the middle of doing something. Very annoying,david willis,12/04/16,4,OTHER,,UI,ERROR,,,,
57894d1b819cb706b00a7b21,AcDisplay,03/08/04,Best lock screen app,alpesh bhagat,12/04/16,5,OTHER,,OTHER,,,,,
57894d1b819cb706b00a7b22,AcDisplay,03/08/04,Works well I would love to see some security added to the lock screen function,Seth Widick,12/04/16,3,INFORMATION_GIVING,,SECURITY,,,,,
57894d10819cb706b00a7b16,AcDisplay,03/08/04,Can't uninstall Won't let me deactivate in order to uninstall.,Amrik Ballagan,13/04/16,1,INFORMATION_GIVING,,ERROR,,,,,
57894d10819cb706b00a7b17,AcDisplay,03/08/04,Doesn't actually lock anything.,nothing here,13/04/16,1,OTHER,,SECURITY,,,,,
57894d14819cb706b00a7b18,AcDisplay,03/08/04,"Amazing App This is cool because if you put your phone in your pocket and take it out it automatically turns it on which can be very convenient if you are waiting for someone to notify you for something. Also, when you turn on you phone you can see all notifications and choose whether to open them or dimiss them with ease.",Andres Ortiz,13/04/16,5,INFORMATION_GIVING,,UI,,,,,
57894d14819cb706b00a7b19,AcDisplay,03/08/04,Perfect I always wanted something like this but I wasn't able to find however I think now I have with you AC Display,S.M Taha,13/04/16,5,PROBLEM_DISCOVERY,,OTHER,,,,,
57894d14819cb706b00a7b1a,AcDisplay,03/08/04,Always on Can you add always on clock feature?,Frederik Born,13/04/16,5,OTHER,,OTHER,,,,,
57894d17819cb706b00a7b1b,AcDisplay,03/08/04,Try add a pass code.,Laender Manzano,13/04/16,4,OTHER,,SECURITY,,,,,
57894d17819cb706b00a7b1c,AcDisplay,03/08/04,Simply superb..! Love the new animation.. It can have more options in customization,Badarinath Gopalakrishna,13/04/16,4,OTHER,,UI,,,,,
57894d10819cb706b00a7b15,AcDisplay,03/08/04,"Great, but seems to get frozen by Android 6.0.1 I love this app, but since upgrade to 6.0.1, the app gets frozen if there are no new notifications. This means the displayed time can be up to 30mins behind the actual time. Can I deactivate this â€œfreezingâ€ù?",Jake Ziegeler,14/04/16,5,OTHER,,ANDROID VERSION,UI,ERROR,,PERFORMANCE,
57894d0a819cb706b00a7b11,AcDisplay,03/08/04,Works good Please make it no time off to changes between clock and notification. And make it clock moves is more great. Thank u,sofie koko,15/04/16,5,OTHER,,UI,,,,,
57894d0d819cb706b00a7b12,AcDisplay,03/08/04,Great but with its downsides (bugs) Awesome lockscreen for seeing and handling notifications. My favorite feature is that I can swipe from anywhere in any direction to unlock. Has a few (very) annoying (recent) bugs such as locking the screen while I'm using my phone if I get a notification or the proximity sensor causing unwanted locks while using,Jeremy Kohtz,15/04/16,4,PROBLEM_DISCOVERY,,UI,ERROR,HARDWARE,,SECURITY,
57894d0d819cb706b00a7b13,AcDisplay,03/08/04,Nice app,naveen chandra,15/04/16,5,OTHER,,OTHER,,,,,
57894d0d819cb706b00a7b14,AcDisplay,03/08/04,Should add fingerprint/pin/pattern security and then it'd be perfect,Colin Cook,15/04/16,5,OTHER,,SECURITY,,,,,
57894d07819cb706b00a7b0e,AcDisplay,03/08/04,"Please add """"always on"""" mode",RÉ™ÅŸad Babaxanov,16/04/16,3,OTHER,,OTHER,,,,,
57894d0a819cb706b00a7b0f,AcDisplay,03/08/04,Works Works great but why is it a constant running notification there should be a way to disable if you want to see that and have it not pop up,Josh M.,16/04/16,5,INFORMATION_GIVING,,UI,ERROR,,,,
57894d0a819cb706b00a7b10,AcDisplay,03/08/04,Being a device administrator keeps getting disabled but other services are kept on. Please fix,Ther Ming Yew,16/04/16,3,PROBLEM_DISCOVERY,,ERROR,,,,,
57894d03819cb706b00a7b09,AcDisplay,03/08/04,Nice! Looks very good and is functional. The wave over to wake screen doesn't seem to work well on my HTC One. But other than that its fantastic.,Evan Gregg,17/04/16,4,OTHER,,DEVICE,ERROR,HARDWARE,,,
57894d03819cb706b00a7b0a,AcDisplay,03/08/04,Superb Nice! _Ÿ‘ç,Raymond Charl Cosep,17/04/16,5,OTHER,,OTHER,,,,,
57894d03819cb706b00a7b0b,AcDisplay,03/08/04,"Almost perfect Awesome work devs with this app, but one suggestion, I would really want to put a different lockscreen wallpaper Instead of black or home screen wallpaper, kindly add that stuff as well to add a custom lockscreen wallpaper",nikhil sharma,17/04/16,4,OTHER,,APP USABILITY,SECURITY,,,,
57894d07819cb706b00a7b0c,AcDisplay,03/08/04,"I have been using it for past 2-3 years and its one of the essential apps for me. Sometimes my phone gets unlocked while in pocket, which is annoying but apart from that, everything is good.",Ranjeet Kaurav,17/04/16,4,OTHER,,SECURITY,ERROR,,,,
57894d07819cb706b00a7b0d,AcDisplay,03/08/04,"Glance plus app (Why its better?) I don't want to use glance plus instead of ac display because acd, it's really beautiful! But I have to use glance plus because of two features: Customisable Analog Clock & Calender (both at different times can be added to lock screen). I don't want to use glance plus. Ac display team please, do something. Thanks. Waiting for your update, acd!",Kirtish Sukhija,17/04/16,3,OTHER,,OTHER,,,,,
57894cfe819cb706b00a7b07,AcDisplay,03/08/04,Good In it swap to unlock the device they have to provide a partton lock as well,Hitesh Shikne,18/04/16,5,INFORMATION_GIVING,OTHER,OTHER,,,,,
57894cfe819cb706b00a7b08,AcDisplay,03/08/04,I would be glad if Fingerprint unlocking will come to AcDisplay I want to see this App as a real Lockscreen replacement _Ÿ‘ç,Aschot Mkrtchyan,18/04/16,5,OTHER,USAGE,SECURITY,,,y,,
57894cf2819cb706b00a7b02,AcDisplay,03/08/04,Good but has some issues with marshmallow I used this on my old phone and if was flawless and I loved it. Now I have switched the the nexus 6p and am having some trouble. I noticed that sometimes when I had ac display activated I would not be able to use the finger print sensor even after I unlocked ac display and had to do a password. This is very frustrating so I cannot use ac display.,Sawyer Seth,19/04/16,4,INFORMATION_GIVING,,ANDROID VERSION,DEVICE,SECURITY,,ERROR,
57894cfc819cb706b00a7b03,AcDisplay,03/08/04,Cannot deactivate device administrator option on s6 edge The app is not allowing to disable the device administrator setting and force closes while doing so. I like the app very much though.,roy a j,19/04/16,2,OTHER,,DEVICE,ERROR,UI,,,
57894cfc819cb706b00a7b04,AcDisplay,03/08/04,"THIS IS THE PERFECT ONE! Now it only misses one thing: a security. After all, it's a lock screen, so it is pretty ironic for a lock screen to not have a security. Also hopefully more customizable, like being able to change your wallpaper. Also the notification bar shouldn't be able to go down while in the lockscreen. Those are my suggestions.",Alexis Zarco,19/04/16,5,OTHER,,SECURITY,UI,,,,
57894cfe819cb706b00a7b05,AcDisplay,03/08/04,Great app!!,NEHORAY MARZIANO,19/04/16,5,OTHER,,OTHER,,,,,
57894cfe819cb706b00a7b06,AcDisplay,03/08/04,The best one,Sarthak Chauhan,19/04/16,5,OTHER,,OTHER,,,,,
57894cd8819cb706b00a7af8,AcDisplay,03/08/04,It keeps asking me for a donation,DJ Sticks,20/04/16,1,OTHER,,PRICE,,,,,
57894cd8819cb706b00a7af9,AcDisplay,03/08/04,"Great Overall, but Needs Lock Function This is one of the best looking and most inventive lock screens I have seen. However, it would be great to see a built-in lock function. It's the one thing keeping me from using this as my current lockscreen.",David Ford,20/04/16,4,OTHER,,SECURITY,,,,,
57894cd8819cb706b00a7afa,AcDisplay,03/08/04,Can't uninstall.,Herman Trouser,20/04/16,1,INFORMATION_GIVING,,ERROR,,,,,
57894ceb819cb706b00a7afb,AcDisplay,03/08/04,"works good for Samsung Galaxy s6 works good on Samsung Galaxy s6 some icons are wrong like for inbox and gmail or built in text messenger which shows delivery report right icon, but shows facebook icon for built in text messager messages and don't show textra messenger icon or chomp I've tried but shows handsent , I haven't had others wrong yet but apart from that works well and not a battery drain hardly notice it's running and it hasn't crashed or randomly jumping on screen like some others I tried so just needs few more updates sorted.",daniel chapman,20/04/16,4,PROBLEM_DISCOVERY,,DEVICE,UI,ERROR,,BATTERY,
57894ceb819cb706b00a7afc,AcDisplay,03/08/04,5 star Great!,Karan Makwana,20/04/16,5,OTHER,,OTHER,,,,,
57894cee819cb706b00a7afd,AcDisplay,03/08/04,"Absolutely hooked Smashing minimalistic design. One note: I would love to use it on my tablet as well, but it seems that it won't autorotate. Perhaps this is a local problem, but it would be nice to see that implemented. Nothing more I can wish for beyond that!",Raoul Buurke,20/04/16,5,OTHER,,UI,ERROR,,,,
57894cee819cb706b00a7afe,AcDisplay,03/08/04,issues with fingerprint sensor fingerprint sensor doesn't seem to work when applied as a lockscreen. Using redmi note 3,gagan singh,20/04/16,3,OTHER,,HARDWARE,DEVICE,ERROR,,,
57894cee819cb706b00a7aff,AcDisplay,03/08/04,Nexus Imprint killed. Please improve the compatibility.,Hsu Chaw-Bin,20/04/16,2,INFORMATION_GIVING,,DEVICE,ERROR,,,,
57894cf2819cb706b00a7b00,AcDisplay,03/08/04,Just can't be perfect Yah I know the developer wouldn't add security but that's what's missing,King Bas,20/04/16,4,INFORMATION_GIVING,,SECURITY,,,,,
57894cf2819cb706b00a7b01,AcDisplay,03/08/04,Best app ever I m enjoying it so much great effect and superb features.,Kartik Kumar,20/04/16,5,OTHER,,OTHER,,,,,
57894ccf819cb706b00a7af3,AcDisplay,03/08/04,"Great! I love how the simplicity applied in this lockscreen gives the idea of a cool way technology works. Just that can you help apply password features to make it look more of a 'lock' screen. Other than that, it's 110% awesome! Thank you!",Opticall,22/04/16,5,OTHER,,APP USABILITY,SECURITY,,,,
57894cd1819cb706b00a7af4,AcDisplay,03/08/04,It won't work The Google ambient display seems to override it. The test notification will work and that's it.,Chuck Marcus,22/04/16,1,INFORMATION_GIVING,,UI,ERROR,,,,
57894cd1819cb706b00a7af5,AcDisplay,03/08/04,"love it wow, the 1st app I must have on any setup",mohand yahia,22/04/16,5,OTHER,,OTHER,,,,,
57894cd5819cb706b00a7af6,AcDisplay,03/08/04,"AcDisplay brings the Active Display mode from Moto devices in a free open source app. The basic feature of this app allows the device's screen to turn when a notification appears and to quickly and easily interact with the notifications. There are 2 other options as well, making this app serve as a lock screen and/or turn on the screen based on device sensors. The overall design is very much minimalistic with a great looking design, and there are also plenty of settings to customize to fit your liking. AcDisplay is great for those wanting to view notifications quickly with a minimal and usable design.",Adrian Silo,22/04/16,5,OTHER,,DEVICE,LICENSING,UI,,APP USABILITY,
57894cd5819cb706b00a7af7,AcDisplay,03/08/04,Just one thing! Please add finger print direct unlock without swipe!,Aman Goel,22/04/16,4,OTHER,,SECURITY,UI,,,,
57894ccb819cb706b00a7aee,AcDisplay,03/08/04,Password I need to set a password. Please allow this app to set password,Izzat Najmi,23/04/16,5,INFORMATION_GIVING,,SECURITY,,,,,
57894ccb819cb706b00a7aef,AcDisplay,03/08/04,"Not able to uninstall When I try to uninstall, it doesn't let me. I found that it needs to be unchecked from device administrator, when I try that it just kicks me out of the settings. Emailed this guys for support before posting this review and waited for a week for the reply but no response. Very disappointed.",Gaurav Jain,23/04/16,2,OTHER,,ERROR,,,,,
57894ccb819cb706b00a7af0,AcDisplay,03/08/04,Nice app Love your work,Sofiane Bencheikh,23/04/16,5,OTHER,,OTHER,,,,,
57894cbc819cb706b00a7ae2,AcDisplay,03/08/04,"Please update lockscreen I love this app, but it constantly freezes my Galaxy S5 when the lockscreen is enabled. Pleas update this app! I would pay for this functionality",Bill Connor,26/04/16,1,OTHER,PRICING,SECURITY,DEVICE,ERROR,,PRICE,
57894c8c819cb706b00a7abf,AcDisplay,03/08/04,Not 5 star Not 5 stars as I believe it should provide option for basic authentication at least say a password or pattern. Otherwise a cool and good app,Shankar S,05/05/16,3,OTHER,PROTECTION,SECURITY,UI,,y,,
57894c27819cb706b00a7a60,AcDisplay,03/08/04,Need full string password protection. Very good and simple lock screen which is very light and functional. Cant really call this as a lock screen as it does'nt has a password protection. It will be the best screen lock on android platform if full string password and (or) finger print protection with privacy control(ability to define apps that could be unlocked with out password) is added to this... Expecting new essential feature soon...,Ratheesh Kumar,30/05/16,3,OTHER,PROTECTION,SECURITY,APP USABILITY,,,,
578937c6819cb7066ab3fb69,Adblock Plus,1.0.3,"Works well but needs a reinstall on each version Great app but stopped blocking with the new update, had to reinstall to get it to work again.",Geoff Wong,22/05/16,4,INFORMATION_GIVING,OTHER,ERROR,,,,,
578937c6819cb7066ab3fb6a,Adblock Plus,1.0.3,Awesome! I like the built in browser particularly for it's fingerprint support. Ghostery has good blocking but is a little flaky. Looks like this is the best of both worlds.,Naveed Ahmed,22/05/16,5,OTHER,OTHER,SECURITY,,,,,
578937c4819cb7066ab3fb67,Adblock Plus,1.0.3,Doesn't work for everything,ANDREW BITTAN,23/05/16,3,PROBLEM_DISCOVERY,OTHER,ERROR,,,,,
578937c4819cb7066ab3fb68,Adblock Plus,1.0.3,Works great,nefarious suoirafen,23/05/16,5,OTHER,OTHER,OTHER,,,,,
578937c4819cb7066ab3fb66,Adblock Plus,1.0.3,I think the best app I do not identified another better,Cm Mc,24/05/16,5,OTHER,OTHER,OTHER,,,,,
578937c3819cb7066ab3fb63,Adblock Plus,1.0.3,Can't use it as it demands I update my samsung browser. Then it takes me to the app page in Google play. I'm unable to download this as it's not compatible with my system. Help please.,L. S.,25/05/16,1,OTHER,COMPATIBILITY,DEVICE,ERROR,,y,,
578937c3819cb7066ab3fb64,Adblock Plus,1.0.3,What exactly is this supposed to do? As far as I can tell this doesn't do anything.....,Joshua Carman,25/05/16,1,PROBLEM_DISCOVERY,OTHER,OTHER,,,,,
578937c4819cb7066ab3fb65,Adblock Plus,1.0.3,Great app!,Qvmd Gaming,25/05/16,5,OTHER,OTHER,OTHER,,,,,
578937c3819cb7066ab3fb62,Adblock Plus,1.0.3,Works,Jayesh Srivastava,26/05/16,5,OTHER,OTHER,OTHER,,,,,
578937c2819cb7066ab3fb61,Adblock Plus,1.0.3,Seen it advertised on bbc so must be of some use. Works so far.,David Richman,27/05/16,5,OTHER,OTHER,OTHER,,,,,
578937c1819cb7066ab3fb5e,Adblock Plus,1.0.3,"Great but doesn't always work When the app actually works it makes browsing the internet really enjoyable. I don't know why it says fixed the issue """"blocker of unwanted content not available"""" when it is still happening.",AntyWar E,28/05/16,3,OTHER,,ERROR,,,,,
578937c2819cb7066ab3fb5f,Adblock Plus,1.0.3,Not working,Auin Naqvi,28/05/16,1,PROBLEM_DISCOVERY,OTHER,ERROR,,,,,
578937c2819cb7066ab3fb60,Adblock Plus,1.0.3,Works Works ! Perfect,Albert Gonzalez,28/05/16,5,OTHER,OTHER,OTHER,,,,,
578937be819cb7066ab3fb5a,Adblock Plus,1.0.3,Yes! It's beautiful. Working like a charm. Thanks!,Mihai Tilea,31/05/16,5,OTHER,OTHER,OTHER,,,,,
578937be819cb7066ab3fb5b,Adblock Plus,1.0.3,Works great When I tried the pre-May 23 version on my S7 edge there was no noticeable ad blocking whatsoever.. but this version works perfectly so far...,Jay Williams,31/05/16,5,OTHER,COMPATIBILITY,DEVICE,,,Y,,
578937be819cb7066ab3fb5c,Adblock Plus,1.0.3,Not Working Always Shows Error On Opening Internet (Samsung browser) after the latest update its not showing any error but now it is no blocking ads. On Websites In Samsung Browser,Sheikh Abdullah,31/05/16,1,OTHER,OTHER,DEVICE,ERROR,,,,
578937c1819cb7066ab3fb5d,Adblock Plus,1.0.3,"Well!!! It's going great but when I browse the website it starts to slow down and some are quite quick but I would not say it's fast. My Samsung internet browser app isn't compatible so it would not work, so I guess I'll have to un-install the app.",Setul Halai,31/05/16,3,PROBLEM_DISCOVERY,OTHER,PERFORMANCE,DEVICE,ERROR,,,
578937bc819cb7066ab3fb59,Adblock Plus,1.0.3,"Works fine on Galaxy S7 Need to install Samsung 'Internet' browser first, then add this and configure blocking in the browser",Shawn Warren,01/06/16,4,INFORMATION_GIVING,COMPATIBILITY,DEVICE,,,Y,,
578937bc819cb7066ab3fb57,Adblock Plus,1.0.3,â˜º Works like a dream,paul m,02/06/16,5,OTHER,OTHER,OTHER,,,,,
