_id,app,appVersion,reviewText,author,date,ratingStars,ArDoc classification,classification,class1,class2,class3,copied to 30each,class4,class5
578945a6819cb706b00a7328,2048,2.06,Fundamental flaw Sometimes drops a 4 instead of a 2. I suspect the error is in the source code because another ad free version does the same. A bothersome glitch.,Larry H,15/01/16,4,OTHER,OTHER,LICENSING,APP USABILITY,ERROR,,,
578945a5819cb706b00a7327,2048,2.06,"Too easy and too slow Being able to undo just one move should be enough to correct false moves, 50 is ridiculous and makes the game annoyingly slow. 3 moves and everybody is happy, yes? Oh and the occasional dropping of 4 has ruined many a game. The undo button took me from a high score of 73000ish to 290552 in one game, finally defeated by a dropped 4.",JÃ_hann G. Ã“lafsson,18/01/16,2,OTHER,USAGE,APP USABILITY,PERFORMANCE,UI,y,ERROR,
578945a5819cb706b00a7326,2048,2.06,"Slow Since latest update, it's moving very slow. The animations are fine, but the time it takes from my finger movement to display is too slow. I was already moving ahead of the animations before, but now I don't even want to play due to the latency.",Zachary Burris,15/02/16,4,OTHER,RESSOURCES,PERFORMANCE,PERFORMANCE,UI,y,ERROR,
578945a5819cb706b00a7325,2048,2.06,love it.. good excercise before i go to work..,ahmir Cruz,20/02/16,5,OTHER,OTHER,OTHER,,,,,
578945a2819cb706b00a7324,2048,2.06,Keeps crashing Since I upgraded my android this game keeps crashing.,Astrid Elkesdottir,26/02/16,1,INFORMATION_GIVING,RESSOURCES,ANDROID VERSION,ERROR,,y,,
578945a2819cb706b00a7323,2048,2.06,Addictive I first became a fan of this game when i got an app that u had to earn coins to unlock diffrent colored lights. How u got coins was to play games and it just happened tbat one of the mini games was this kind of game!!!,Holly Youngstrom,22/04/16,5,INFORMATION_SEEKING,OTHER,OTHER,,,,,
578945a2819cb706b00a7322,2048,2.06,Ad free port of the original open source game.,Mike McLean,01/05/16,5,OTHER,OTHER,LICENSING,,,,,
578945a2819cb706b00a7321,2048,2.06,Lag city,Samantha Payge,18/05/16,2,OTHER,RESSOURCES,PERFORMANCE,,,y,,
578945a0819cb706b00a7320,2048,2.06,Good idea. +1 for Open Source. Edit: Cannot stand blurriness anymore.,Eto Demerzel,20/05/16,2,INFORMATION_GIVING,USAGE,ERROR,,,y,,
578945a0819cb706b00a731f,2048,2.06,Undo feature slows down app,Morten Nilsen,29/05/16,5,OTHER,OTHER,PERFORMANCE,UI,,,,
578945a0819cb706b00a731e,2048,2.06,Super â™¡â™¡â™¡â™¡â™¡â™¡â˜†â˜†â˜†â˜…â˜…â˜…â™¥â™¥â™¥,A. V . NEMI RAAJ,21/06/16,5,OTHER,,OTHER,,,,,
578945a0819cb706b00a731d,2048,2.06,Addiction maximized My daughter (a Mathie) told me about this game. I am happy there is an undo button now. I wish this version were available for the Kindle.,Jann Schott,23/06/16,5,FEATURE_REQUEST,,UI,DEVICE,,,,
578939e0819cb7066ab3fd60,A Comic Viewer,1.4.1.4,"Fix app Its a okay app, but mi images dont load all da way through and sum times I get a error message wen im tryna look at my images, fix it and me rating will change",A Google User,20/09/12,2,PROBLEM_DISCOVERY,OTHER,ERROR,,,,,
578939e0819cb7066ab3fd5f,A Comic Viewer,1.4.1.4,Not very practical There r much better comic viewers than this 4android,A Google User,26/09/12,3,OTHER,OTHER,OTHER,,,,,
578939db819cb7066ab3fd5b,A Comic Viewer,1.4.1.4,Great comic viewing app The best comic / manga / pictorial viewing app.,A Google User,30/09/12,5,OTHER,OTHER,OTHER,,,,,
578939db819cb7066ab3fd5c,A Comic Viewer,1.4.1.4,May have gotten higher stars if.. Unfortunately it was stuck on one screen without the ability to check for comic or start reading...perhaps this is due to having the Samsung illusion idk..,A Google User,30/09/12,2,OTHER,COMPATIBILITY,DEVICE,UI,ERROR,y,,
578939db819cb7066ab3fd5d,A Comic Viewer,1.4.1.4,"Simple but Usefull I like apps like this, simple and usefull.",A Google User,30/09/12,5,OTHER,OTHER,APP USABILITY,,,,,
578939e0819cb7066ab3fd5e,A Comic Viewer,1.4.1.4,Best comic scan app in the market! Worked good on my G1& Droid. Works great on my HTC Thunderbolt.CBZ's & Folders are the best way to view. CBR's sometimes glitch. I convert to CBZ/ZIP mostly.,A Google User,30/09/12,5,OTHER,COMPATIBILITY,DEVICE,ERROR,,y,,
578939d8819cb7066ab3fd59,A Comic Viewer,1.4.1.4,Best Offline Reader I've tried many comic readers to read the comics saved to my sd card and this is the best by far.,A Google User,01/10/12,5,OTHER,COMPATIBILITY,HARDWARE,,,y,,
578939d8819cb7066ab3fd5a,A Comic Viewer,1.4.1.4,Good fer me!,A Google User,01/10/12,5,OTHER,OTHER,OTHER,,,,,
578939d8819cb7066ab3fd58,A Comic Viewer,1.4.1.4,"Pretty Close to Perfect. This app is way better than any comic book reader I've ever used. It's small, it operates fast, and the interface is incredibly clean and simple. Literally my only complaint is the ""Oops, Sorry couldn't read"" error, which I'm not entirely sure is because of the app. Fantastic application, I recommend to anyone who takes their comics on the go.",A Google User,05/10/12,4,OTHER,OTHER,PERFORMANCE,UI,ERROR,,,
578939d4819cb7066ab3fd57,A Comic Viewer,1.4.1.4,5 out of 5 Awesome,A Google User,06/10/12,5,OTHER,OTHER,OTHER,,,,,
578939d1819cb7066ab3fd54,A Comic Viewer,1.4.1.4,"Great Except constant file errors, others don't do this.",A Google User,08/10/12,1,PROBLEM_DISCOVERY,OTHER,ERROR,,,,,
578939d4819cb7066ab3fd55,A Comic Viewer,1.4.1.4,Unable to load Has a lot of problems loading comics do to a memory issue.,A Google User,08/10/12,1,OTHER,RESSOURCES,MEMORY,ERROR,,Y,,
578939d4819cb7066ab3fd56,A Comic Viewer,1.4.1.4,"Good reader... This app can open manga through zip, it's very useful....",A Google User,08/10/12,5,OTHER,USAGE,OTHER,,,Y,,
578939d1819cb7066ab3fd53,A Comic Viewer,1.4.1.4,Same problem This is the best comic reader by far i ve used. But the oops error is annoying. The app works when it wants to work and thats not a good thing:/.,A Google User,09/10/12,2,OTHER,OTHER,ERROR,,,,,
578939d1819cb7066ab3fd52,A Comic Viewer,1.4.1.4,"oops! used to love this app, now every comic i read comes up with oops! and something about being ou of memory. happens on both my phone and my tablet, both running different roms.",A Google User,10/10/12,2,OTHER,RESSOURCES,MEMORY,ERROR,DEVICE,Y,,
578939ce819cb7066ab3fd51,A Comic Viewer,1.4.1.4,Hmmm...,A Google User,12/10/12,1,OTHER,OTHER,OTHER,,,,,
578939cb819cb7066ab3fd4e,A Comic Viewer,1.4.1.4,Ooopps...all the time,A Google User,13/10/12,1,OTHER,OTHER,OTHER,,,,,
578939ce819cb7066ab3fd4f,A Comic Viewer,1.4.1.4,Good but could use fixing After a while I get a lot of errors saying the app is out of memory which fix themselves erratically and unpredictably so I can never read many files at one go. Other than that I enjoy the app's clean interface and ease of use.,A Google User,13/10/12,4,OTHER,RESSOURCES,MEMORY,ERROR,APP USABILITY,Y,,
578939ce819cb7066ab3fd50,A Comic Viewer,1.4.1.4,. I dont hav it yet but does it hav moviestarplanet,A Google User,13/10/12,1,OTHER,OTHER,OTHER,,,,,
578939cb819cb7066ab3fd4d,A Comic Viewer,1.4.1.4,"No preloading Takes time to load every image when reading in sd card, recommend Perfect Viewer by RookieStudio over this app",A Google User,16/10/12,2,OTHER,COMPATIBILITY,HARDWARE,PERFORMANCE,,Y,,
578939cb819cb7066ab3fd4c,A Comic Viewer,1.4.1.4,Ooops errors caused me to delete this app Fix it,A Google User,19/10/12,1,INFORMATION_GIVING,,ERROR,,,,,
578939cb819cb7066ab3fd4b,A Comic Viewer,1.4.1.4,Not bad but the swipe need improvement.,A Google User,20/10/12,3,INFORMATION_GIVING,USAGE,UI,,,,,
578939c8819cb7066ab3fd4a,A Comic Viewer,1.4.1.4,Excellent Has no trouble with anything. I had some trouble figuring out how the controls work but only because i didnt really read the description. This is on a galaxy note 10.1,A Google User,22/10/12,5,OTHER,OTHER,UI,DEVICE,APP USABILITY,,,
578939b9819cb7066ab3fd48,A Comic Viewer,1.4.1.4,"Couldn't make it through one comic. The UI is pretty nice, I guess. Problem is, it couldn't get me through a single comic - the same ""Oops"" error that everyone else seems to be getting. Perfect Viewer has been working out well enough. It's certainly not ""Perfect"", but I can actually read my comics, so it's close enough for now.",A Google User,23/10/12,2,OTHER,,UI,ERROR,,,,
578939b9819cb7066ab3fd49,A Comic Viewer,1.4.1.4,"Refuses to display image It says I'm low on memory when reading cbr files and therefore refuses to display more pages. Although it recommends to unpack the file, I still think, that the app should be written better so this wouldn't happen.",A Google User,23/10/12,1,FEATURE_REQUEST,,MEMORY,ERROR,,,,
578939b5819cb7066ab3fd47,A Comic Viewer,1.4.1.4,"Nice, but has some problems. Works fairly well. Most comic book archives open and preloading makes sure you can go through them quickly. Has a good amount of options to tweak your experience. One point deduction because it has some bugs and improvement points that have been around forever: I get errors on some archives, and I can never see the full error because it's always cut off (""Can not open archive. This generally happens because ..."" Because what??). The main menu always shows the logo in big, and then the last two archives opened. There's so much more you can do with this space. When you zoom, it seems to remember that zoom level for every *other* page, rather than every page.",A Google User,24/10/12,4,OTHER,,PERFORMANCE,UI,APP USABILITY,,ERROR,
578939b1819cb7066ab3fd46,A Comic Viewer,1.4.1.4,"Fast, light, and does what needs to be done! Great app. It's really fast, takes up only 673k of space and remembers which page you were at when you close the app. I appreciate the ability to customize controls...you can tailor it to your reading style.I This is the first and only app review I plan on doing...nothing quite like ACV. A must for comic readers.",A Google User,26/10/12,5,OTHER,,PERFORMANCE,UI,MEMORY,,,
578939b1819cb7066ab3fd45,A Comic Viewer,1.4.1.4,No longer that fast,A Google User,28/10/12,3,OTHER,,PERFORMANCE,,,,,
578939b1819cb7066ab3fd44,A Comic Viewer,1.4.1.4,"Impresive I think it should have a full 5 stars! It dosnt take up hardly any space it reads comics well, no noticable sluging allthough I think it may have a bug and if you have the right apps you can make your own comics and read them or shair them!",A Google User,29/10/12,5,PROBLEM_DISCOVERY,,MEMORY,PERFORMANCE,,,,
578939a2819cb7066ab3fd43,A Comic Viewer,1.4.1.4,"Clean controls, cbr problems It's relatively quick and has nice control settings, but I find it often has odd memory errors in cbr files that prevent their viewing. Perfect Viewer has no problem opening the same files, but I find the usability of this app to be superior - when it works.",A Google User,31/10/12,3,PROBLEM_DISCOVERY,,UI,MEMORY,APP USABILITY,,ERROR,
578939a2819cb7066ab3fd42,A Comic Viewer,1.4.1.4,"There's a better option, guys. I don't normally post comments or ratings for apps but I felt it was worth pointing out to people that, while this app does get the job done, it was simply too much of a hassle to use, and 9 times out of 10 a comic would give me a memory crash error at some point. Perfect Viewer has so far performed significantly better for me, and not once have I ran into any problems with it.",A Google User,03/11/12,3,OTHER,,APP USABILITY,MEMORY,ERROR,,,
5789399b819cb7066ab3fd41,A Comic Viewer,1.4.1.4,Slow and Unresponsive Swipe to go to turn page often takes 4 or 5 attempts. Slow to load next page compared to other image viewers.,A Google User,04/11/12,3,OTHER,,PERFORMANCE,UI,ERROR,,,
57893998819cb7066ab3fd3c,A Comic Viewer,1.4.1.4,"Would be perfect if... This app has a very nice interface, but struggles too often displaying even simple comic files, while other readers have no issues at all. When they fix its reliability I will give it another shot as well as a 5-star review.",A Google User,05/11/12,3,INFORMATION_GIVING,,UI,ERROR,,,,
57893998819cb7066ab3fd3d,A Comic Viewer,1.4.1.4,Spot on,A Google User,05/11/12,5,OTHER,,OTHER,,,,,
57893998819cb7066ab3fd3e,A Comic Viewer,1.4.1.4,Could be good but..... Keeps crashing on SGS2 Claims out if memory error as in other reports. Looks good otherwise,A Google User,05/11/12,1,OTHER,,MEMORY,ERROR,DEVICE,,,
57893998819cb7066ab3fd3f,A Comic Viewer,1.4.1.4,"Best Comic Reader Simple, lightweight, customizable.",A Google User,05/11/12,5,OTHER,,PERFORMANCE,,,,,
5789399b819cb7066ab3fd40,A Comic Viewer,1.4.1.4,"It ain't too bad. This is a great app, when it works. I would still recommend it, but the message that a memory error has been found is highly annoying. Needs to be fixed as I'm sure there is no memory error.",A Google User,05/11/12,3,OTHER,,MEMORY,ERROR,,,,
57893994819cb7066ab3fd3b,A Comic Viewer,1.4.1.4,Fail Does not read from sd card even after mounted. Reads from internal memory only. Droid x2,A Google User,06/11/12,1,OTHER,,HARDWARE,DEVICE,ERROR,,,
57893994819cb7066ab3fd3a,A Comic Viewer,1.4.1.4,"Can't use Galaxy s2, flipping to next page in landscape mode causes possible out of memory messages. I've got plenty of memory free though. Simply can't use it. Other comic viewers work just fine.",A Google User,08/11/12,1,OTHER,,DEVICE,MEMORY,APP USABILITY,,ERROR,
57893994819cb7066ab3fd38,A Comic Viewer,1.4.1.4,"Average for now Pretty comfortable and easy to use, but refuses to display some pages that work with all other comic book readers.",A Google User,09/11/12,3,OTHER,,APP USABILITY,ERROR,,,,
57893994819cb7066ab3fd39,A Comic Viewer,1.4.1.4,Update add ads popup,A Google User,09/11/12,2,OTHER,,LICENSING,UI,,,,
57893991819cb7066ab3fd37,A Comic Viewer,1.4.1.4,"Good app Best for manga, but not good for. Rar",A Google User,10/11/12,5,OTHER,,OTHER,,,,,
57893991819cb7066ab3fd36,A Comic Viewer,1.4.1.4,"No updates? Nothing? I've downgraded my review from 5 to 2 stars because I'm having to use another app for cbr files. How long is it going to take to get cbr support out of beta? This would be the best comic reader out there if only the dev would sort out the issues. Until then, I'll be using a reader that actually works.",A Google User,15/11/12,2,OTHER,,ERROR,,,,,
57893991819cb7066ab3fd35,A Comic Viewer,1.4.1.4,Not good. I've got a phone with 2GB of RAM and it is running out of memory?,A Google User,18/11/12,1,OTHER,,MEMORY,HARDWARE,ERROR,,,
5789398e819cb7066ab3fd34,A Comic Viewer,1.4.1.4,Rubbish No load folder option and claims to be a manga reader yeah good luck this app is an insult to real apps...,A Google User,19/11/12,1,OTHER,,UI,,,,,
5789398e819cb7066ab3fd33,A Comic Viewer,1.4.1.4,"Exactly what i was looking for Good settings, great usability, perfect for me!!!!!",A Google User,20/11/12,5,OTHER,,APP USABILITY,,,,,
5789398e819cb7066ab3fd32,A Comic Viewer,1.4.1.4,Very Intuitive but has Problems Consistently runs out of memory. This program requires too much effort for leisure time. If it stops running out of memory it could be the best reader out there. Keeping it installed hoping for fixes.,A Google User,21/11/12,3,OTHER,,MEMORY,APP USABILITY,ERROR,,,
5789398b819cb7066ab3fd31,A Comic Viewer,1.4.1.4,Oops Can't stand the oops error. uninstall,A Google User,24/11/12,2,OTHER,,ERROR,,,,,
5789398b819cb7066ab3fd30,A Comic Viewer,1.4.1.4,"Brilliant Excellent app easy to use. Customisable controls make resizing on phone simple. To people with unable to read error, it's a cbr file format issue. Convert file to cbz and it will work fine.",A Google User,25/11/12,5,INFORMATION_GIVING,,APP USABILITY,ERROR,,,,
5789398b819cb7066ab3fd2e,A Comic Viewer,1.4.1.4,"S'ok Randomly crashes saying it cant load a page. Then it will say """"this generally..."""" and thats it.",Ash John,29/11/12,2,OTHER,,ERROR,,,,,
5789398b819cb7066ab3fd2f,A Comic Viewer,1.4.1.4,Some bugs. Sometimes images don't load correctly and appear as blank grey at the bottom. I'm not sure what this is about.,A Google User,29/11/12,4,OTHER,,ERROR,,,,,
57893988819cb7066ab3fd2d,A Comic Viewer,1.4.1.4,"Petty good, but few hiccups. This is an awesome reader. Every now and then ill get some kind of error trying to load certain files, but when that happens I just usually use an alternative reader. I'll be updating to the premium version for the hell of it.",Alvaro Garcia,30/11/12,4,OTHER,PRICING,ERROR,LICENSING,,,,
57893988819cb7066ab3fd2c,A Comic Viewer,1.4.1.4,No menu button Seems like a good app. I paid for the premium and I can't even bring up a menu.,Bobby Barna,01/12/12,2,INFORMATION_GIVING,PRICING,UI,LICENSING,ERROR,,,
57893988819cb7066ab3fd2b,A Comic Viewer,1.4.1.4,Memory error Keep getting a memory error on my s3...,Chad McQueen,03/12/12,4,INFORMATION_GIVING,,MEMORY,DEVICE,ERROR,,,
57893985819cb7066ab3fd2a,A Comic Viewer,1.4.1.4,Great Just greaaaat. :),A Google User,04/12/12,5,OTHER,,MEMORY,DEVICE,ERROR,,,
57893985819cb7066ab3fd27,A Comic Viewer,1.4.1.4,"Haven't used any others... But I don't plan on it, this one has been great and real easy to use I highly recomend it",ian roos,05/12/12,5,INFORMATION_GIVING,,APP USABILITY,,,,,
57893985819cb7066ab3fd28,A Comic Viewer,1.4.1.4,So far Not had any problems yet Only gripe is when I go to the next page of comic and it zooms in. But doesn't ruin it :-),Laura Lee Woods,05/12/12,5,OTHER,,OTHER,,,,,
57893985819cb7066ab3fd29,A Comic Viewer,1.4.1.4,No SD card support Was really good but now I can't view my SD card anymore... please fix,A Google User,05/12/12,1,INFORMATION_GIVING,,HARDWARE,ERROR,,,,
57893982819cb7066ab3fd26,A Comic Viewer,1.4.1.4,Sucks Way to many errors,A Google User,09/12/12,1,OTHER,,ERROR,,,,,
57893982819cb7066ab3fd25,A Comic Viewer,1.4.1.4,"Keeps Crashing Same problem that everyone else is having. """"Opps"""" error has ruined any goodwill I had toward this app.",Todd Carnley,10/12/12,1,OTHER,,ERROR,,,,,
57893982819cb7066ab3fd24,A Comic Viewer,1.4.1.4,Frequent error messages It is so frustrating when one of those 'oops' messages come up. It seems to be happening more frequently. Please fix this,Julia Jeon,11/12/12,2,PROBLEM_DISCOVERY,,ERROR,,,,,
5789397f819cb7066ab3fd22,A Comic Viewer,1.4.1.4,Genial Recomendable para leer cÃ_mics. Ideal para tabletas. Sgs3,Matias Larango,12/12/12,5,OTHER,,OTHER,,,,,
57893982819cb7066ab3fd23,A Comic Viewer,1.4.1.4,Realy great Perfect for reading commics!,Zarko Stamenkovic,12/12/12,5,OTHER,,OTHER,,,,,
5789397f819cb7066ab3fd21,A Comic Viewer,1.4.1.4,"4/5 rans out of memory on larger comics, and sometimes zoom chages between pages, other thab that, works fine",A Google User,13/12/12,4,OTHER,,MEMORY,APP USABILITY,ERROR,,,
57893972819cb7066ab3fd1e,A Comic Viewer,1.4.1.4,"bad really really bad , Komik is much much better and no ads , and smaller in size and u can actually find it in the ur android market . you can even set your main comic folder.",Mohammad Omar,16/12/12,1,OTHER,,LICENSING,PERFORMANCE,,,,
57893972819cb7066ab3fd1f,A Comic Viewer,1.4.1.4,Ok Very messy looking interface. Not intuitive. Wide range of options for viewing your comics though.,Matthew Wallace,16/12/12,3,OTHER,,APP USABILITY,ERROR,UI,,,
57893972819cb7066ab3fd20,A Comic Viewer,1.4.1.4,Poor Would not read sd card. Useless.,Gary Dymock,16/12/12,1,OTHER,,HARDWARE,ERROR,,,,
57893972819cb7066ab3fd1d,A Comic Viewer,1.4.1.4,"Muito bom!! Recomendo, um Ã_timo visualizador de HQ's para tablet!",Gustavo Possatti,19/12/12,5,OTHER,,OTHER,,,,,
5789396f819cb7066ab3fd1c,A Comic Viewer,1.4.1.4,"Needs a LOT of work! Far too many """"memory"""" issues",Dani Thornton,20/12/12,2,OTHER,,MEMORY,ERROR,,,,
5789396f819cb7066ab3fd1b,A Comic Viewer,1.4.1.4,Crashing Keeps crashing mid comic,Sebastian Zapata,21/12/12,1,INFORMATION_GIVING,,ERROR,,,,,
5789396a819cb7066ab3fd19,A Comic Viewer,1.4.1.4,Good app! Good app!,Adam Sheppard,22/12/12,4,OTHER,,OTHER,,,,,
5789396f819cb7066ab3fd1a,A Comic Viewer,1.4.1.4,"Good, but needs update I liked this reader a while back, but since I started managing my files via Google Drive rather than transferring files back and forth to the SD Card I noticed that this app does not work. It needs to register a URL handler for .cbz and .cbr files. For now I uninstalled and switched to Perfect Viewer.",Archimedes Trajano,22/12/12,3,OTHER,,HARDWARE,ERROR,,,,
5789396a819cb7066ab3fd17,A Comic Viewer,1.4.1.4,"Needs to change screen orientation Works well. Didn't get much error messages, but I can't change the screen orientation when my device is rotated.",Juan Valerio,24/12/12,4,INFORMATION_GIVING,,ERROR,,,,,
5789396a819cb7066ab3fd18,A Comic Viewer,1.4.1.4,Excelent Best comic viewer:-),Keith Hedger,24/12/12,5,OTHER,,OTHER,,,,,
57893968819cb7066ab3fd15,A Comic Viewer,1.4.1.4,Very bad Bad due fails to load comic due to out of memory error,Larry Kalis,25/12/12,1,INFORMATION_GIVING,,MEMORY,ERROR,,,,
5789396a819cb7066ab3fd16,A Comic Viewer,1.4.1.4,"Could only handle small sized file Force closed when opening big sized cbr file. It's working very well actually. Open up a file, pinch zoom, next/previous page button.",Udayalaksmanakartiyasa Halim,25/12/12,3,OTHER,,UI,PERFORMANCE,ERROR,,,
57893968819cb7066ab3fd14,A Comic Viewer,1.4.1.4,Out of memory error,Amboy Suarez,27/12/12,3,OTHER,,MEMORY,ERROR,,,,
57893968819cb7066ab3fd13,A Comic Viewer,1.4.1.4,Worked well...What happened? I had used this app to read comics on my Nexus 7 for the last couple months but now suddenly I keep running into problems where a few pages in and an error prompt comes up. A nearly flawless app now suddenly unable to read anything entirely.,Josh Prentice,31/12/12,3,OTHER,,DEVICE,ERROR,,,,
57893968819cb7066ab3fd12,A Comic Viewer,1.4.1.4,Nice,Sourabh Kumar,03/01/13,4,OTHER,,OTHER,,,,,
57893964819cb7066ab3fd11,A Comic Viewer,1.4.1.4,"Error message I want to give this five stars. This is such an awesome reader, but the fact that I get nothing but memory errors is a bit irritating. Pretty convinced it is the apparently itself because I have way too much memory. Heh",salsasharklexi,05/01/13,3,OTHER,,MEMORY,ERROR,,,,
5789395f819cb7066ab3fd0f,A Comic Viewer,1.4.1.4,Good Nine,Sukhdeep Singh,06/01/13,5,OTHER,,OTHER,,,,,
57893964819cb7066ab3fd10,A Comic Viewer,1.4.1.4,"Slightly better than Onion Comic Viewer In my quest to find a functional comic viewer I ran across ACV. While this program has better page and comic selection navigation it suffers with numerous crashes, just the same as Onion Comic Viewer. It especially fails with graphic novels, which are typically larger files than regular comics. It starts to read until it reaches ""maximum memory"" (about page 32) then crashes every time I tried to open to the next page. This occurred at almost the same point with larger comics. I have since moved to Comic Rack which has not crashed once, can read very large files and has amazing navigation features.",David Porter,06/01/13,3,OTHER,,UI,ERROR,MEMORY,,,
5789395f819cb7066ab3fd0d,A Comic Viewer,1.4.1.4,Nice but.... Sometimes it doesnt read the whole comic and its anoying,Juan Gonzalez,10/01/13,3,OTHER,,ERROR,,,,,
5789395f819cb7066ab3fd0e,A Comic Viewer,1.4.1.4,"Sad... Its the second time i download this app... my galaxy s2 and wont open i tap on logo pops menu only options are 'share, open, settings' if i go open just goes to my sdcard memory stuff..",A Google User,10/01/13,1,OTHER,,DEVICE,UI,HARDWARE,,,
5789395f819cb7066ab3fd0c,A Comic Viewer,1.4.1.4,Greate app!,HÃ  Nguyá»…n Trung,11/01/13,4,OTHER,,OTHER,,,,,
5789395c819cb7066ab3fd0b,A Comic Viewer,1.4.1.4,Great! Not perfect but still very good!,Jersson Gomez,13/01/13,5,OTHER,,OTHER,,,,,
5789395c819cb7066ab3fd0a,A Comic Viewer,1.4.1.4,Totally 100% Tolomus approved really great for hardcore comic fans even for new ones. Best apps ever. Easy to navigate. zoom read etc,tolom karam,14/01/13,5,OTHER,,UI,APP USABILITY,,,,
57893959819cb7066ab3fd07,A Comic Viewer,1.4.1.4,"Brilliant Works great on my galaxy tab 2. You can set the screen size to whatever suits you best, and it reads from the external card. Works with cbr and cbz files, I have really enjoyed reading some old DC comics that made me feel quite nostalgic. Cant beat it seeing as its free!",Matt Brooks,17/01/13,5,INFORMATION_GIVING,,DEVICE,HARDWARE,LICENSING,,PRICE,
5789395c819cb7066ab3fd08,A Comic Viewer,1.4.1.4,Frustrating Menu keeps coming up while scrolling. Gestures don't always work correctly. Looks good and clean but jittery and buggy in my experience.,Nathan Leon,17/01/13,2,OTHER,,UI,APP USABILITY,ERROR,,,
5789395c819cb7066ab3fd09,A Comic Viewer,1.4.1.4,Good application it will be better if you make your app more smooth and add previews for each pics when locate the pages,Ran Bao,17/01/13,4,FEATURE_REQUEST,,APP USABILITY,,,,,
57893959819cb7066ab3fd06,A Comic Viewer,1.4.1.4,"Ugly Interface Startup interface doesn't utilize screen space well at all. Corrupt file/memory errors are more common than you'd expect. Other readers read the same files perfectly. Overall a decent app that can work, just not always.",Jake Sinkey,18/01/13,3,OTHER,,UI,MEMORY,ERROR,,,
57893955819cb7066ab3fd05,A Comic Viewer,1.4.1.4,"Well, When It Works It works beautifully, if it does at all.",lazy bhikkhu,19/01/13,1,OTHER,,OTHER,,,,,
57893955819cb7066ab3fd02,A Comic Viewer,1.4.1.4,I don't understand Started out great now always getting low or out of memory error. Got it set to low memory still doing it. Have over 2gb on phone free what's up????,Greg Damron,22/01/13,1,OTHER,RESSOURCES,MEMORY,HARDWARE,ERROR,y,,
57893955819cb7066ab3fd03,A Comic Viewer,1.4.1.4,"So close, so far Works great except for the out of memory errors. Restarting the app or even my device makes no change.",Ian Both,22/01/13,2,OTHER,,MEMORY,ERROR,,,,
57893955819cb7066ab3fd04,A Comic Viewer,1.4.1.4,doesnt read from SD Card on my tablet doesnt read from SD Card on my tablet just reads from internal memory,Sudeb Sarkar,22/01/13,2,INFORMATION_SEEKING,,HARDWARE,MEMORY,ERROR,,,
57893952819cb7066ab3fd01,A Comic Viewer,1.4.1.4,"Out of memory error It's quite useless as I always get the out of memory error eventually, which doesn't happen with other apps.",Semir Begovic,24/01/13,1,OTHER,,MEMORY,ERROR,,,,
