_id,app,appVersion,reviewText,author,date,ratingStars,ArDoc classification,classification,class1,class2,class3,copied to 30each,class4,class5
57893851819cb7066ab3fc16,A Comic Viewer,1.4.1.4,Decent if you don't like to read You can look at pictures but forget getting understanding what's going on because he bottom of every page is garbage.,sean hammond,26/03/14,1,PROBLEM_DISCOVERY,,ERROR,,,,,
5789384e819cb7066ab3fc14,A Comic Viewer,1.4.1.4,It Perfect. Sometimes the comics are a little messed up.,Saad A,31/03/14,4,OTHER,,ERROR,,,,,
5789384e819cb7066ab3fc12,A Comic Viewer,1.4.1.4,Awesome Best one I tried,Imraan Knight,01/04/14,5,OTHER,,OTHER,,,,,
5789384e819cb7066ab3fc13,A Comic Viewer,1.4.1.4,"Very good, i always use it when reading comics",xuan dinh Pham,01/04/14,4,OTHER,,OTHER,,,,,
5789384c819cb7066ab3fc10,A Comic Viewer,1.4.1.4,This comic viewer is different to many others... It works!!! 5 stars...,Robert Greenwood,03/04/14,5,OTHER,,OTHER,,,,,
5789384c819cb7066ab3fc11,A Comic Viewer,1.4.1.4,"Excellent in every regard except... This is an excellent app and I couldn't be happier. I have also tried Komik, but noticed that the images are blurry when scrolling and takes a second for it to sharpen. ACV does not have this problem! One feature that this app desperately needs, however, is full screen support (which Komik has). Please add full screen support for those running Kit Kat and this will be the perfect comic reader :D",Chris,03/04/14,4,INFORMATION_GIVING,,UI,ANDROID VERSION,,,,
5789384c819cb7066ab3fc0f,A Comic Viewer,1.4.1.4,Out of memory error Unusable,Fuqing Lin,08/04/14,1,OTHER,,MEMORY,ERROR,,,,
5789384a819cb7066ab3fc0d,A Comic Viewer,1.4.1.4,Okay at best Crashes after 3-4 pages,Anthony Crum,13/04/14,2,OTHER,,ERROR,,,,,
5789384a819cb7066ab3fc0e,A Comic Viewer,1.4.1.4,Cbr and cbz fail Fail on opening pages but comicrack works.,PlÃ_nio Valente,13/04/14,1,INFORMATION_GIVING,,ERROR,,,,,
5789384a819cb7066ab3fc0c,A Comic Viewer,1.4.1.4,Best!!!!! It is a very app as I can read cbz and cbr files through it and it help me alot.,A Google User,14/04/14,5,OTHER,,OTHER,,,,,
57893847819cb7066ab3fc09,A Comic Viewer,1.4.1.4,I highly recommend it Very great app to view your comics/books/etc data,Michael DeSmyther,19/04/14,5,OTHER,,OTHER,,,,,
57893847819cb7066ab3fc0a,A Comic Viewer,1.4.1.4,"Use to be my favorite Cbr files! I go between three different readers. Perfect Viewer, Comics Reader and ACV. ACV has the best layout but doesn't play all my files!",Anthony Eccleston,19/04/14,2,OTHER,,ERROR,,,,,
5789384a819cb7066ab3fc0b,A Comic Viewer,1.4.1.4,"Image files &gt; 2MB are not loaded properly and the app crashes, I've switched to another reader. Too bad this one is great with my archos gamepad 2.",Florent Deschamps,19/04/14,3,OTHER,,ERROR,,,,,
57893843819cb7066ab3fc07,A Comic Viewer,1.4.1.4,"Open source, Ads, Site points to spam I ""installed"" just so I can say this, the domain points to those fake search sites and just returns spam/junk and attempts to install fake versions of Flash. My trust from this company is gone, but I have no issues sifting through the source-code to compile and install locally.",Zaephor O'TeWind,22/04/14,1,PROBLEM_DISCOVERY,,LICENSING,,,,,
57893843819cb7066ab3fc08,A Comic Viewer,1.4.1.4,Ugly Had problems with comics others read.,Nemanja Borovac,22/04/14,2,PROBLEM_DISCOVERY,,ERROR,,,,,
57893843819cb7066ab3fc06,A Comic Viewer,1.4.1.4,Not good Switching to another reader.,Cuycoy Rivera,26/04/14,1,OTHER,,OTHER,,,,,
57893843819cb7066ab3fc05,A Comic Viewer,1.4.1.4,FC in every book after a few pages,Omar Omar,09/05/14,1,OTHER,,OTHER,,,,,
5789383f819cb7066ab3fc04,A Comic Viewer,1.4.1.4,"Good app, needs better file search Very good app, would like a better way to search for files to add.",Adil Hussain,12/05/14,4,OTHER,,OTHER,,,,,
5789383f819cb7066ab3fc03,A Comic Viewer,1.4.1.4,"Doesn't work on cbr files CBR is supposedly supported, it is nog working right though. It always crashes on cbr comics on my galaxy tablet (2) and seldom works on my Galaxy S4. No updates to fix this.",Henry Yandun,14/05/14,1,PROBLEM_DISCOVERY,,ERROR,DEVICE,,,,
5789383f819cb7066ab3fc02,A Comic Viewer,1.4.1.4,This app gives me problem with opening .cbr files. I thought at first it was because of the files are corrupted but when I download a different comic viewer it works just fine.,Norzawani Buang M Yassin,16/05/14,1,OTHER,,ERROR,,,,,
5789383c819cb7066ab3fc01,A Comic Viewer,1.4.1.4,This app have a good quality,Tyrone Ornopia,21/05/14,5,OTHER,,OTHER,,,,,
5789383c819cb7066ab3fbff,A Comic Viewer,1.4.1.4,"Great app, except for with CBR On most CBR files, it'll throw an error about being out of memory. Doesn't matter if you're on a device with 512mb, or 2gb of RAM, and will always do it on the same pages. Open it up in another reader, on the same device, zero problems. Long time user, but this has just got to be too much.",Keith Brown,27/05/14,2,OTHER,RESSOURCES,MEMORY,HARDWARE,ERROR,y,,
5789383c819cb7066ab3fc00,A Comic Viewer,1.4.1.4,half of the screen is messed up plus takes so much time to move from one page to next...,Karim Mistry,27/05/14,1,OTHER,,UI,PERFORMANCE,ERROR,,,
5789383a819cb7066ab3fbfe,A Comic Viewer,1.4.1.4,Broken Every page that it shows are half broken and are unable read,Jack Whimarem Weels,28/05/14,1,OTHER,,ERROR,,,,,
5789383a819cb7066ab3fbfd,A Comic Viewer,1.4.1.4,"Great app Very useful 4 reading comic books.,,luv it",Shirapthi Spidey,30/05/14,4,OTHER,,OTHER,,,,,
5789383a819cb7066ab3fbfc,A Comic Viewer,1.4.1.4,Always ran out of memory This app sucks. Dont download this one,Armand Sutjianto,10/06/14,1,INFORMATION_GIVING,,MEMORY,ERROR,,,,
578937f5819cb7066ab3fb9f,A Comic Viewer,1.4.1.4,"amazing i have been using this viewer for years. i am utterly impressed. however, the drain on the battery is the only thing that keeps me from using it often.",deliverence rise,07/04/15,4,OTHER,RESSOURCES,BATTERY,ERROR,,y,,
57893c2d819cb7066ab4001a,Abstract Art,01/01/03,"Awesome! I always thought the battle backgrounds would make great live wallpapers. Thanks for putting this together! By the way, the background picker references a menu button for more options but the menu is not available on the G.Nexus for some reason.",A Google User,02/10/12,5,INFORMATION_GIVING,COMPATIBILITY,DEVICE,UI,,y,,
57893c2b819cb7066ab40019,Abstract Art,01/01/03,Worth buying a smart phone for. This made it worth the cost of getting a smart phone. Thank you.,A Google User,11/10/12,5,OTHER,OTHER,DEVICE,,,,,
57893c2b819cb7066ab40018,Abstract Art,01/01/03,Great! PSI Rockin!,A Google User,20/10/12,5,OTHER,OTHER,OTHER,,,,,
57893c2b819cb7066ab40017,Abstract Art,01/01/03,"Oh Baby! I love Earthbound! This app is great and cool, it is a great condiment for your Android phone item!",A Google User,25/10/12,5,OTHER,OTHER,DEVICE,,,,,
57893c29819cb7066ab40016,Abstract Art,01/01/03,"Awesome app any earthbound fan will love This is the coolest app, I think if it want free people would purchase it. Thanks a ton for making this sick earthbound app!",A Google User,11/11/12,5,OTHER,OTHER,LICENSING,,,,,
57893c29819cb7066ab40015,Abstract Art,01/01/03,Superb! Absolutely spectacular. Emulates the Earthbound backgrounds beautifully without compromising battery life. A+ Material!,SgtMettool,04/12/12,5,OTHER,RESSOURCES,BATTERY,,,y,,
57893c29819cb7066ab40014,Abstract Art,01/01/03,Great Works perfectly.,Damien McFalls,21/12/12,5,OTHER,OTHER,OTHER,,,,,
57893c29819cb7066ab40013,Abstract Art,01/01/03,This is the best thing. It really is.,Josh McFadden,25/12/12,5,OTHER,OTHER,OTHER,,,,,
57893c27819cb7066ab40012,Abstract Art,01/01/03,"love it Thank you for this great EB. wallpaper. I also paid the donation for this app. I just wish you tossed in a song or something for the paid version. But all in all it is good, it will be my main wallpaper for years.",Graham Fahlman,02/01/13,5,OTHER,PRICING,LICENSING,,,y,,
57893c27819cb7066ab40011,Abstract Art,01/01/03,Cool app! Fuzzy Pickles!,Najeem Baysudee,03/01/13,5,OTHER,,OTHER,,,,,
57893c27819cb7066ab40010,Abstract Art,01/01/03,"Just finished the game today and These look exactly like the game! I think the sprites look a little funny, but I know that's just from blowing them up so big. I might just remove them later. Still love it though! Thanks for making this!",Collin C.,04/01/13,5,OTHER,OTHER,OTHER,,,,,
57893c24819cb7066ab4000f,Abstract Art,01/01/03,Fantastic The visuals look exactly like earthbound. I definitely recommend that you try it out!,Eric Boone,07/01/13,5,OTHER,OTHER,OTHER,,,,,
57893c24819cb7066ab4000e,Abstract Art,01/01/03,Amazing I love you man this is just what I was looking for thank you.,Cainer R,26/01/13,5,INFORMATION_GIVING,OTHER,OTHER,,,,,
57893c24819cb7066ab4000d,Abstract Art,01/01/03,"Deserves no less than 5 stars There is a paid version. I can't imagine it could be any better than this. This is all I want in an earthbound live wallpaper. I'm going to now make a go launcher icon pack so that my contacts, aps, sms and camera are Ness, Paula Jeff and Poo. There is just one user who gave less that 5 stars. We should paint him blue.",A Google User,27/01/13,5,OTHER,PRICING,LICENSING,,,Y,,
57893c22819cb7066ab4000c,Abstract Art,01/01/03,Suggestion: Add Mother 3! You should definitely add mother 3 enemies and their backgrounds. That would be so cool! XD,Quinn Benskin,17/02/13,5,OTHER,OTHER,OTHER,,,,,
57893c22819cb7066ab4000b,Abstract Art,01/01/03,"Absolutely Amazing If you love earthbound as much as I do (played it as a child on SNES) you will smile every single time you power you phone on and see the live wallpaper change to a new enemy animation. A+++ 10/10! If your phone does not have a live wallpapers icon in your settings, install aniBrush Abstract Live wallpaper, and it will open your live wallpaper settings and you can set it to the Earthbound.",Andrew Paskiewicz,12/03/13,5,OTHER,OTHER,OTHER,,,,,
57893c22819cb7066ab4000a,Abstract Art,01/01/03,"My favorite app ever Very well made app, thoroughly enjoy just looking at my screen all day XD. Bought the app without a second thought. Much thanks to the developer!",Sargon Bakoz,14/03/13,5,OTHER,OTHER,LICENSING,,,,,
57893c1c819cb7066ab40009,Abstract Art,01/01/03,Brilliant! Please keep developing!,Bedford Nieves-Sanchez,12/04/13,5,INFORMATION_GIVING,OTHER,OTHER,,,,,
57893c1c819cb7066ab40008,Abstract Art,01/01/03,Fantastic! Really nice look. Great options.,Brad Smith,20/04/13,5,OTHER,OTHER,UI,,,,,
57893c1c819cb7066ab40007,Abstract Art,01/01/03,Exactly what I wanted Fantastic! Simple and sublime.,Kyle Ott,21/04/13,5,OTHER,OTHER,APP USABILITY,,,,,
57893c1c819cb7066ab40006,Abstract Art,01/01/03,Great work This is the coolest app in the entire play store. Only way it could be more epic was if you added the ones from Mother 3 as well.,Bradley Carey,03/05/13,5,INFORMATION_GIVING,,OTHER,,,,,
57893c1a819cb7066ab40005,Abstract Art,01/01/03,"Awesome It runs flawlessly and it's always amusing to watch. But please add in Heavily Armed Pokey's sprite. Oh, and yes Mother 3 wallpapers would be excellent.",Angel Suazo,06/05/13,5,OTHER,,PERFORMANCE,,,,,
57893c16819cb7066ab40004,Abstract Art,01/01/03,Awesome! I can't believe the amount of customization and detail that went into this. Such a great idea.,Andrew Cochrane,10/05/13,5,OTHER,,OTHER,,,,,
57893c16819cb7066ab40003,Abstract Art,01/01/03,"Personal favorite Love this wallpaper, thank you",Martin M,25/05/13,5,OTHER,,OTHER,,,,,
57893c16819cb7066ab40002,Abstract Art,01/01/03,"Amazing job These wallpapers were just the ones I wanted. Also a suggestion, you should add Mother 3 aswell.",Just Frank,02/06/13,5,INFORMATION_GIVING,,OTHER,,,,,
57893c16819cb7066ab40001,Abstract Art,01/01/03,"Best EarthBound app ever I love the variety in my backgrounds now. Constant reminders of my favorite game ever are welcome and awesome. """"Potential!""""",Tefka Suuno,04/06/13,5,OTHER,,OTHER,,,,,
57893c14819cb7066ab40000,Abstract Art,01/01/03,"Missing Options Awesome, but I see no way to access options (check all, uncheck all) in the chooser without a physical action button. Thank you for creating and open sourcing! Purchased the donation version.",Ian Boyte,12/06/13,4,OTHER,,UI,LICENSING,,,,
57893c14819cb7066ab3fffe,Abstract Art,01/01/03,"Awesome! But no Diamond Dog? I really do love this app, and now can't think of having anything else as a wallpaper. But you forgot Diamond Dog! Please include him!",Jean Escalante,13/06/13,5,OTHER,,OTHER,,,,,
57893c14819cb7066ab3ffff,Abstract Art,01/01/03,"Awesome App Small download, works well and appears to be light on system resources. Also, EB nerdgasm.",Chad Steele,13/06/13,5,OTHER,,PERFORMANCE,,,,,
57893c11819cb7066ab3fffd,Abstract Art,01/01/03,Great work! This is a must have by any Earthbound/Mother fan!,Najee Eaglin,16/06/13,5,OTHER,,OTHER,,,,,
57893c11819cb7066ab3fffc,Abstract Art,01/01/03,Great All earthbound fans will love it!,Trilo Byte,22/06/13,5,OTHER,,OTHER,,,,,
57893c11819cb7066ab3fffb,Abstract Art,01/01/03,"Just brilliant So simple, but so perfect. Mother 2 is my favorite game of all time. If you could add Mother 3 characters/enemies, whether it's in this wallpaper as a update or a separate app, I'd happy pay a buck or two for it. :)",Anthony Schaaf,29/06/13,5,OTHER,,LICENSING,,,,,
57893c0f819cb7066ab3fff9,Abstract Art,01/01/03,"Masterful. I would like to thank you, George, for this incredible creation. Yes, I realize that it is just a wallpaper for my phone based on one of the best video games ever made but I cannot help but appreciate its perfection. It brings me to the wonderful state of mind I was in during those first experiences with that amazing game each time I look at my phone and trust me in that it is a great place. Playing it or not, I am now EarthBound.",neil burt,20/07/13,5,OTHER,,DEVICE,,,,,
57893c0f819cb7066ab3fffa,Abstract Art,01/01/03,"Love it It looks awesome, thank you!",Incesticide23,20/07/13,5,OTHER,,OTHER,,,,,
57893c0b819cb7066ab3fff8,Abstract Art,01/01/03,This app STINKS! Best live wallpapers PERIOD! Only way it could possibly be better would be to add Mother 3 as a separate option for wallpapers.,Randy Paul,26/07/13,5,FEATURE_REQUEST,,UI,,,,,
57893c0b819cb7066ab3fff7,Abstract Art,01/01/03,"Smaaaaaaashing! Hands down, the greatest app ever made. Thank you.",Chris Rodriguez,28/07/13,5,OTHER,,OTHER,,,,,
57893c0b819cb7066ab3fff6,Abstract Art,01/01/03,Smaaash! Oh this app is my all time favorite live wallpaper. Developer you did a fantastic job. I have one suggestion please make a scrolling hp battery meter. It would make my day.,Jordan Mcnutt,06/08/13,5,OTHER,,BATTERY,UI,,,,
57893c09819cb7066ab3fff5,Abstract Art,01/01/03,"Nostalgic These are pretty awesome. Although my epileptic girlfriend isn't a big fan, the backgrounds are exactly what I expected. Galaxy S4",Kenneth Belovarac,13/08/13,5,OTHER,,DEVICE,,,,,
57893c09819cb7066ab3fff4,Abstract Art,01/01/03,Amazing. Awesome idea and it runs perfectly. Thanks!,Bryan Stine,15/08/13,5,OTHER,,OTHER,,,,,
57893c09819cb7066ab3fff3,Abstract Art,01/01/03,Say Fuzzy Pickles! Awesome application! I've always wanted a Giygas live wallpaper!,Daniel Fonseca,17/08/13,5,OTHER,,OTHER,,,,,
57893c08819cb7066ab3fff2,Abstract Art,01/01/03,SMAAAAAAAAASH!!! Wow! This is absolutely flawless and beautiful. Everyone should get this and also donate. It's just... Wow.,Dave Yarwood,19/08/13,5,OTHER,,LICENSING,,,,,
57893c08819cb7066ab3fff1,Abstract Art,01/01/03,"Smaaashing! Perfectly executed. Sound pack next, please!",Dale Cmaylo,10/09/13,5,INFORMATION_GIVING,,OTHER,,,,,
57893c08819cb7066ab3fff0,Abstract Art,01/01/03,Love this These wallpapers really bring me back to the year 199X. Have had this on my phone for months and I still love it! Thanks for making this!,Brendan Barr,09/10/13,5,OTHER,,DEVICE,,,,,
57893c08819cb7066ab3ffef,Abstract Art,01/01/03,â€¢Abstract Art set up a wallpaper! SMAAAASH!! â€¢Ness became diamondized!,Jake Stelman,14/10/13,5,OTHER,,OTHER,,,,,
57893c06819cb7066ab3ffee,Abstract Art,01/01/03,Love it! Clearly a lot out hard work went into making this. Kudos to the developer for including so many backgrounds. This is a must for any EB fan.,Ricky Mukalian,20/10/13,5,OTHER,,OTHER,,,,,
57893c06819cb7066ab3ffed,Abstract Art,01/01/03,Magical,Michael Meehan,08/11/13,5,OTHER,,OTHER,,,,,
57893c06819cb7066ab3ffec,Abstract Art,01/01/03,Beautiful Amazing idea with amazing delivery,Eusebio Sanchez,23/11/13,5,OTHER,,OTHER,,,,,
57893c06819cb7066ab3ffeb,Abstract Art,01/01/03,Excellent!! Runs great on my LG G2. Nostalgia at its best :),Josh Simmons,01/12/13,5,OTHER,,DEVICE,,,,,
57893c04819cb7066ab3ffea,Abstract Art,01/01/03,Great app Can't believe someone didn't think of this sooner,Tommy Stevens,11/12/13,5,INFORMATION_GIVING,,OTHER,,,,,
57893c04819cb7066ab3ffe9,Abstract Art,01/01/03,Really Awesome EarthBound is my favorite game... This app is the best. Thanks.,Kimball Shan E,17/12/13,5,OTHER,,OTHER,,,,,
57893c04819cb7066ab3ffe8,Abstract Art,01/01/03,Earthbound love Just amazing. I am absolutely in love with this app. The best wallpaper I've had to date. I can't stop looking at it!,Jenna Marie,19/12/13,5,INFORMATION_GIVING,,OTHER,,,,,
57893c04819cb7066ab3ffe7,Abstract Art,01/01/03,"Love it!!! I loved the game and it's quirky, modern, trippy 8-bit aesthetics. Great app!!!",Rommel Tolentino,25/12/13,5,OTHER,,OTHER,,,,,
57893c02819cb7066ab3ffe5,Abstract Art,01/01/03,"Awesome! This is a really great app. One suggestion, add the New Age Retro Hippie enemy. Plus, the first time looking through enemies, a random message that read ""Stop, you're squishing me!"" I'm still wondering how I did that. Can someone explain that please?",Jared Smith,30/12/13,5,OTHER,,OTHER,,,,,
57893c02819cb7066ab3ffe6,Abstract Art,01/01/03,"I like the app, But I cant use it",Lacoble Coble,30/12/13,5,INFORMATION_GIVING,,OTHER,,,,,
57893c02819cb7066ab3ffe4,Abstract Art,01/01/03,"Awesome But... I'm not quite sure what model my zh&k tablet is. I just know that it is a jellybean device. But more to the point, everytime I set this live wallpaper, by the time its set, it comes up saying ""Unfortunately, Abstract Art Has Stopped"",and closes itself, but brings up a default wallpaper. Fix This if possible and I will Give 5 Stars. I Am A HUGE fan of earthbound.",Johnny Cenate,07/01/14,3,OTHER,,ANDROID VERSION,DEVICE,ERROR,,,
57893bfe819cb7066ab3ffe3,Abstract Art,01/01/03,"This runs waaay smoother than the ""Earthbound Battle Backgrounds"" app. Plus it's free, and I would have been willing to to pay for this.",A Google User,09/01/14,5,OTHER,PRICING,PRICE,,,y,,
57893bfe819cb7066ab3ffe2,Abstract Art,01/01/03,. awesome :),michael hislop,11/01/14,5,OTHER,,OTHER,,,,,
57893bfe819cb7066ab3ffe1,Abstract Art,01/01/03,:D It's wonderful,Brian Cox,14/01/14,5,OTHER,,OTHER,,,,,
57893bfc819cb7066ab3ffe0,Abstract Art,01/01/03,Yes! Just wonderful :) wish it had interactive elements such as a smash attack,Justin H,19/01/14,5,FEATURE_REQUEST,,OTHER,,,,,
57893bfc819cb7066ab3ffdf,Abstract Art,01/01/03,"Psi Love Thank you so much dude. I can't express how happy this makes me. This is probably my favorite game ever. I've been really stressed about things lately but now every time I open my phone, my feelings become calm and happy. It's stupid to say but this means something to me. (However I don't get the application for it on my Galaxy s4, please fix!)",Cody Woods,20/01/14,5,OTHER,,DEVICE,,,,,
57893bfc819cb7066ab3ffde,Abstract Art,01/01/03,"Nostalgia ! This makes me smile. So well put together, I can almost feel the controller in my hands and hear the timeless tunes. A must for any smart phone wielding Earthbound fan.",vikinglucio,26/01/14,5,OTHER,,OTHER,,,,,
57893bf7819cb7066ab3ffdd,Abstract Art,01/01/03,Awesome Good,Nocuma Alvitre,01/02/14,5,OTHER,,OTHER,,,,,
57893bf7819cb7066ab3ffda,Abstract Art,01/01/03,The best So much memories come flowing back,Israyil Petrus-Bryan,07/02/14,5,OTHER,,OTHER,,,,,
57893bf7819cb7066ab3ffdb,Abstract Art,01/01/03,"It's a SMAAASH! It's easy on the battery, has a great variety of backgrounds to choose from, and still retains that psychedelic retro feel.",Erik Stolle,07/02/14,5,OTHER,,BATTERY,,,,,
57893bf7819cb7066ab3ffdc,Abstract Art,01/01/03,Gave me the chills Seeing Giygas going crazy still gets to me. But I love it! Add Heavily Armored Pokey and it would be perfect,Steven Hepburn,07/02/14,5,OTHER,,OTHER,,,,,
57893bf5819cb7066ab3ffd9,Abstract Art,01/01/03,"You cannot grasp the true form of this wallpaper's awesomeness! I can't think of a thing to complain about with this live wallpaper, except that sometimes after a few minutes the animation goes jerky until you switch to another battle background, and the ticks of which BGs are selected could be way more visible. Even that though can't make me give less than 5 â˜…s.",pixel girl,11/02/14,5,INFORMATION_GIVING,,PERFORMANCE,,,,,
57893bf5819cb7066ab3ffd8,Abstract Art,01/01/03,Best ever! My favorite game growing up. Glad to see that there is so many options and ways to adjust the background.,Rachel Zamora-Fong,13/02/14,5,INFORMATION_GIVING,,UI,,,,,
57893bf5819cb7066ab3ffd7,Abstract Art,01/01/03,Amazing Amazing app,Terriq Hussain,24/02/14,5,OTHER,,OTHER,,,,,
57893bf0819cb7066ab3ffd6,Abstract Art,01/01/03,"So sick Oh my god i love this app. Best wallpaper ever. Does everything it says it does, with the added bonus of blowing your mind every time you see your phone . 5 stars for sure.",A Google User,26/02/14,5,OTHER,,OTHER,,,,,
57893bf0819cb7066ab3ffd5,Abstract Art,01/01/03,Best wallpaper period. Any Mother fan would enjoy this. There has been quite a lot of effort put into it. You should definitely consider creating a Mother 3 version. Outstanding job.,Christian Xavier Rodriguez,27/02/14,5,OTHER,,OTHER,,,,,
57893bf0819cb7066ab3ffd4,Abstract Art,01/01/03,"Perfect Might want to be allowed to change animation rate... other than that, just needs music Edit: turns out that simply changing your selected backgrounds on an s3 does not change the rotation, requires resetting it as your live background.",Jeffrey Miller,01/03/14,4,INFORMATION_GIVING,,DEVICE,,,,,
57893bed819cb7066ab3ffd3,Abstract Art,01/01/03,Flaccid no longer! This simple download has cured me of erectile disfunction! A must have for any mother fan,Nicolas Grimm,02/03/14,5,OTHER,,OTHER,,,,,
57893bed819cb7066ab3ffd2,Abstract Art,01/01/03,Great! Does exactly what it says it does. Very easy to pick/choose backgrounds. Fantastic!,Heather Mcgowan,05/03/14,5,OTHER,,OTHER,,,,,
57893bed819cb7066ab3ffd1,Abstract Art,01/01/03,Psi Rockin The enemy has left a present. Inside the present was a cookie. Ness took the cookie.,Robert Dyess,10/03/14,5,OTHER,,OTHER,,,,,
57893bed819cb7066ab3ffd0,Abstract Art,01/01/03,"Perfect for Fans If you love EarthBound/Mother, then you love this wallpaper.",Daniel Brady,14/03/14,5,OTHER,,OTHER,,,,,
57893bec819cb7066ab3ffcf,Abstract Art,01/01/03,No bugs I'm a huge fan of all mother games this is amazing dude great job this thing works like a charm if i hit any real bugs ill let you know honestly,Eric Carrell,04/04/14,5,INFORMATION_GIVING,,OTHER,,,,,
57893bec819cb7066ab3ffcd,Abstract Art,01/01/03,Awesome app!!!! For an earthbound fan this is amazing! Thanks for The Giygas wallpaper! &gt;:) You cannot grasp the true form of Giygas Attack!,Muna Salman,09/04/14,5,INFORMATION_GIVING,,OTHER,,,,,
57893bec819cb7066ab3ffce,Abstract Art,01/01/03,This wallpaper stinks! :) There's no complaints to be made. This wallpaper runs smoothly and never ever crashes or slows down my phone. It also doesn't eat up battery life.,Tony Russell,09/04/14,5,OTHER,,PERFORMANCE,BATTERY,,,,
57893be9819cb7066ab3ffcc,Abstract Art,01/01/03,It shortens battery life a bit but that's really the only flaw. The backgrounds are amazing and spot on and there are none left out,Ariana Edie,18/04/14,4,OTHER,,BATTERY,ERROR,,,,
57893be9819cb7066ab3ffcb,Abstract Art,01/01/03,awesome best app ever please add more at least hippy and porky,Sweet T,23/04/14,5,INFORMATION_GIVING,,OTHER,,,,,
57893be9819cb7066ab3ffc9,Abstract Art,01/01/03,Blue blue.,Lavin Zhang,26/04/14,5,OTHER,,OTHER,,,,,
57893be9819cb7066ab3ffca,Abstract Art,01/01/03,"Groovy! Never thought I'd find something like this out there! I especially love the lack of ads and gimmicks! Good job, sir. You've done us all proud.",John Loeppky,26/04/14,5,OTHER,,OTHER,,,,,
57893be7819cb7066ab3ffc8,Abstract Art,01/01/03,AWESOME This is just so freakin cool could you make a mother 3 one?,Bryce Harmon,03/05/14,5,INFORMATION_GIVING,,OTHER,,,,,
57893be7819cb7066ab3ffc7,Abstract Art,01/01/03,Best background ever Its just so perfect!,Ben Leavitt,04/05/14,5,OTHER,,OTHER,,,,,
57893be7819cb7066ab3ffc6,Abstract Art,01/01/03,Perfect recreation! You're the best.,Stephen Manary,07/05/14,5,OTHER,,OTHER,,,,,
57893be7819cb7066ab3ffc5,Abstract Art,01/01/03,Fantastic Very faithful to a great game.,Nick Malavolti,08/05/14,5,OTHER,,OTHER,,,,,
57893be7819cb7066ab3ffc4,Abstract Art,01/01/03,Help. Wont install on my galaxy centura if you can fix this ill insta 5 stars,Dye go,15/05/14,2,PROBLEM_DISCOVERY,,DEVICE,ERROR,,,,
57893be5819cb7066ab3ffc3,Abstract Art,01/01/03,This is the only Live Wallpaper to use.,Thomas Nelson,16/05/14,5,OTHER,,OTHER,,,,,
57893be5819cb7066ab3ffc2,Abstract Art,01/01/03,"Not showing up on HTC One M8 I just switched over from my S3 to the HTC One M8 and this wallpaper isn't appearing under my Live Wallpapers, even though another one I had downloaded from the Play Store (the one that comes with Beautiful Widgets) appears.",A Google User,19/05/14,5,OTHER,,DEVICE,,,,,
57893be5819cb7066ab3ffc1,Abstract Art,01/01/03,Great App Doesn't ask for any,Detlow Coffin,21/05/14,5,OTHER,,OTHER,,,,,
57893be1819cb7066ab3ffbe,Abstract Art,01/01/03,Best This is the best live wallpaper. People think I'm really cool when they see my phone now.,George Russell,09/06/14,5,OTHER,,OTHER,,,,,
57893be1819cb7066ab3ffbf,Abstract Art,01/01/03,Nice job!,Andrew Burnett,09/06/14,5,OTHER,,OTHER,,,,,
57893be5819cb7066ab3ffc0,Abstract Art,01/01/03,Waaavy This rules,Tyler Bronis,09/06/14,5,OTHER,,OTHER,,,,,
